"created_utc","author","title","url"
1613160152,"Aleo8300","I Rubbed my magic Lamp 3 times a day for GME &amp; All the retards, Got in heavy @$360. My name is retard Aladdin.","https://www.reddit.com/r/wallstreetbets/comments/lijejv/i_rubbed_my_magic_lamp_3_times_a_day_for_gme_all/"
1613160075,"koreanoverlord","Started with $3k, got to 20k, then this whole GME thing happened. Lost 13k with EXPR, the rest from shorting GME.","https://i.redd.it/gblqubylr3h61.jpg"
1613159782,"GoonOnAGrom","Ran out of green crayons to color my screen, so I opened another brokerage and bought 25 GME","https://i.redd.it/lcyjf33kq3h61.png"
1613159677,"Pirate720","Favorite number and favorite color 🟥, thanks GME couldn’t have done it without you 🥰📈⤵️","https://i.imgur.com/xfFI8hc.jpg"
1613159530,"JuoPeoria","US WALL STREET BETS MONKEY BRAINS CIRCLE AROUND AND GO GME AND AMC TO THE MOON 🚀🚀🚀🚀🚀🚀🚀🚀🚀🚀🚀🚀🚀","https://www.youtube.com/watch?v=-Zn75eMkaoE"
1613159093,"spacecoastlabs202","How did you turn your GME misfortune around","https://www.reddit.com/r/wallstreetbets/comments/lij0lp/how_did_you_turn_your_gme_misfortune_around/"
1613159083,"MarcusVentures","LP: GME Edition 👁👄👁 Mix of shares &amp; calls. STILL HOLDING!","https://i.redd.it/sg8jswono3h61.jpg"
1613158949,"chadwickinvestments","AMC &amp; GME ‘Holders”","https://www.reddit.com/r/wallstreetbets/comments/liiyss/amc_gme_holders/"
1613158890,"rkyPaFi","Lost 23k on GME","https://www.reddit.com/r/wallstreetbets/comments/liiy0n/lost_23k_on_gme/"
1613158760,"Onboarding92","Daily reminder that buying GME at 300 before 28/1 was a great play at the time.","https://www.reddit.com/r/wallstreetbets/comments/lid5uz/daily_reminder_that_buying_gme_at_300_before_281/?utm_source=ifttt"
1613158675,"alucaci","GME CAN WE PLEASE BOUNCE BACK??","https://www.reddit.com/r/wallstreetbets/comments/liiv7o/gme_can_we_please_bounce_back/"
1613158439,"Betitall85","GME GOIN UP!","https://i.redd.it/xiv06ksqm3h61.jpg"
1613158149,"1PercentMax","GME + AMC + SPCE Gains - Not What You Think!","https://www.reddit.com/r/wallstreetbets/comments/liiobn/gme_amc_spce_gains_not_what_you_think/"
1613157865,"Smokedcuban","GME &amp; AMC ready for liftoff 🚀 💎💎 Volumes staying low due to holds , shorts are fucked OUR time is coming be ready for next week . They have averaged out at the bottom , only direction left is 🆙 🦍🦍💎💎🙏🚀🚀 This is not financial advise my gf hits me","https://www.reddit.com/gallery/liikpw"
1613157802,"Pirate720","Red is my favorite color, thanks GME 🥰❤️🔴🔻🟥","https://i.imgur.com/hVo8isv.jpg"
1613157758,"missilesarefun","I took a good look at the GME situation I belive the squeeze will come, I have more of a ED Educated Guess.","https://www.reddit.com/r/wallstreetbets/comments/liijfl/i_took_a_good_look_at_the_gme_situation_i_belive/"
1613157636,"Leo-the-Lion01","ARE ANY RETARDS STILL HOLDING THE GME &amp; AMC LINE WITH ME &amp; MEL!? 💥🚀🗽🦅🥁🎖 🎇🕺🏻🍕🍔💰🎢🏈🏟📈🐂💎🙌🚫👑🇺🇸🏴‍☠️🏁","https://www.reddit.com/r/wallstreetbets/comments/liihti/are_any_retards_still_holding_the_gme_amc_line/"
1613157382,"The_Cowboy_Killer","GME giveth and GME taketh.","https://i.redd.it/tdbd8rjlj3h61.jpg"
1613156745,"Smartestgeniusever","GME Apes that still have 💎🤌","https://i.redd.it/2b2z75jph3h61.jpg"
1613156564,"The_Greyscale","Late GME Gain porn. Cleared 2 mil from an 80k investment. (100k transferred prior to screenshot)","https://i.redd.it/iypv7sr5h3h61.jpg"
1613156424,"manusatx","How does alteryx look, for short term quick bucks to offset GME and Nokia.","https://www.reddit.com/r/wallstreetbets/comments/lii0tx/how_does_alteryx_look_for_short_term_quick_bucks/"
1613156411,"SquirrelinaSuit","Yahoo Finance really trying to get me to sell GME out here 😂 I think I’ll just buy more 🤑","https://i.redd.it/oghpixopg3h61.jpg"
1613156038,"ACNY168","i bought more GME today！！！","https://www.reddit.com/r/wallstreetbets/comments/lihvhf/i_bought_more_gme_today/"
1613155897,"The_Dr_Zoidberg","There is no GME moon. It already happened. Don’t bite on the dumb people.","https://www.reddit.com/r/wallstreetbets/comments/lihtl1/there_is_no_gme_moon_it_already_happened_dont/"
1613155772,"ishaanatlife","Will any legal action take place for all the brokers who intentionally blocked new positions on the GME stock?","https://www.reddit.com/r/wallstreetbets/comments/lihrfu/will_any_legal_action_take_place_for_all_the/"
1613155721,"InvisibleLeftHand","To the lesser retards, plz ELI5 the insane Feb 26th calls for GME","https://www.stockoptionschannel.com/symbol/gme/?symbol=GME&amp;month=20210226&amp;type=call"
1613155396,"_picture_me_rollin_","GME reeeeeee 2-12 thread. ( since mods trynna muzzle 🦍).","https://www.reddit.com/r/wallstreetbets/comments/lihmnm/gme_reeeeeee_212_thread_since_mods_trynna_muzzle/"
1613155175,"oosome","GME Gains. Started with $4,500 in November, &gt;1.5 mil in February.","https://www.reddit.com/r/wallstreetbets/comments/lihjwy/gme_gains_started_with_4500_in_november_15_mil_in/"
1613154822,"Early-Jacket-1836","GME FOREVER","https://www.reddit.com/r/wallstreetbets/comments/liheu4/gme_forever/"
1613154698,"savagecivilian9","Good Try Yahoo finance, 1/3 average volume because of diamond hands and all of a sudden you suggest ""realising a loss"" as a tax write off. Thanks tips. GME held till death. Ill burn my physical shares before I sell them back to Melvin.","https://i.redd.it/8pc6xl7mb3h61.png"
1613154562,"dizzy_dizzle","Warning: GME discussion","https://www.reddit.com/r/wallstreetbets/comments/lihba6/warning_gme_discussion/"
1613153894,"jbro12345","GME Gains. Started with $4,500 in November, &gt;1.5 mil in February.","https://www.reddit.com/r/wallstreetbets/comments/lih2mv/gme_gains_started_with_4500_in_november_15_mil_in/"
1613153709,"Kutuzo","I am seeing a B00ty pattern here guys, or maybe a Sack of Bankruptcy seeds, dunno GME","https://i.redd.it/3vneer7d83h61.png"
1613153479,"skwizbags","GME is MooOoOOning!!! Squeeezze!1!","https://i.redd.it/i130otgu73h61.jpg"
1613153204,"ternvall","Weekly reminder that GME 🚀🌝 was killed to protect pe**p**les in high places.","https://www.reddit.com/r/wallstreetbets/comments/ligsx1/weekly_reminder_that_gme_was_killed_to_protect/"
1613152947,"LeroyyyJankins","GME thread for 2/12 since we have to do everything around here 😐","https://www.reddit.com/r/wallstreetbets/comments/ligpdj/gme_thread_for_212_since_we_have_to_do_everything/"
1613152907,"ArthurBarnhart","LDI up 80% today, people are drooling over 5% GME gains when they could be making actual money","https://i.redd.it/h6tmolma63h61.jpg"
1613152481,"LeroyyyJankins","GME thread for 2/12 since we gotta do everything around here","https://www.reddit.com/r/wallstreetbets/comments/ligifh/gme_thread_for_212_since_we_gotta_do_everything/"
1613152450,"-pkns","Summary - the GME WSB 💎👐🚀 Gang","https://v.redd.it/l5w2ib9k43h61"
1613152215,"itiswhatitis2323","GME Megathread?","https://www.reddit.com/r/wallstreetbets/comments/ligeyc/gme_megathread/"
1613151416,"Frostcrest","-140k GME Loss Porn. Held through the peak.","https://www.reddit.com/gallery/lig3rr"
1613151313,"AggieatLSU","Loss Porn - sponsored by GME","https://v.redd.it/17yw9f6i13h61"
1613150897,"Wild-Lead3240","HRSTW, will run like GME SOON!","https://www.reddit.com/r/wallstreetbets/comments/lifwuv/hrstw_will_run_like_gme_soon/"
1613150769,"Jumpy-Sail3812","Get out off GME soon","https://www.reddit.com/r/wallstreetbets/comments/lifv53/get_out_off_gme_soon/"
1613150660,"Bella_US","Sold all my AMC....and bought more GME baby.🚀🚀🚀the whales are coming🐋","https://i.redd.it/c5p1e15mz2h61.jpg"
1613150519,"Domoimprota1992","GME AND AMC... how is this even possible?","https://www.reddit.com/gallery/lifrko"
1613150445,"Domoimprota1992","How is this even possible?! GME","https://www.reddit.com/gallery/lifq9h"
1613150437,"B1gben99","MASSIVE GME CASH INJECTION INCOMING","https://www.reddit.com/gallery/lifq4u"
1613150272,"B1gben99","MASSIVE GME CASH INJECTION INCOMING","https://www.reddit.com/gallery/lifns9"
1613150170,"jbro12345","Started in Nov with $4,500 to &gt;1.5 mil GME in Feb","https://imgur.com/0LEd0WQ"
1613150018,"TomReisenthal","REDDIT MADE ME LOSE $24,000 | LIFE SAVINGS GONE | SAD | Featuring Mr. Beast!! WSB WallStreetBets GME","https://youtu.be/lRhrFXVLhc0"
1613149657,"Olgapetrushenko","Sell GME Buy Nano? Where has this sub gone.","https://www.reddit.com/r/wallstreetbets/comments/liffsk/sell_gme_buy_nano_where_has_this_sub_gone/"
1613149559,"Smoothcriminal007-","Troops good morning from moon I can see GME approaching.. Set your sell limits to 10,000$","https://www.reddit.com/r/wallstreetbets/comments/lifehd/troops_good_morning_from_moon_i_can_see_gme/"
1613149486,"tony_lasagne","Just spent the last hour making a spreadsheet of my portfolio. Was pleased to see both GME and AMC at the very bottom when I sorted by return! (kill me)","https://www.reddit.com/r/wallstreetbets/comments/lifdaf/just_spent_the_last_hour_making_a_spreadsheet_of/"
1613149436,"Dr_Drop_out","You pathetic GME bag holders, wanna actually get on a train? LDI opened yesterday","https://i.redd.it/drlb17uyv2h61.jpg"
1613149004,"suliy99","GME","https://www.reddit.com/r/wallstreetbets/comments/lif656/gme/"
1613148521,"wiseoldmeme","Dimensional Fund Advisors exited GME by Feb 3","https://www.dimensional.com/us-en/insights/how-we-handled-gamestop"
1613148470,"Ebah31","Still holding strong with GME and SNDL boys 💪💪💪","https://i.redd.it/b1lzyg63t2h61.jpg"
1613148375,"Frostcrest","I'm emotionally ready to show my hold through the peak of GME","https://www.reddit.com/gallery/liexyr"
1613148361,"Lassagna12","GME Megathread. Because the MODS forgot.","https://www.reddit.com/r/wallstreetbets/comments/liexrd/gme_megathread_because_the_mods_forgot/"
1613148358,"chris2036","Made a Screenshot of when GME took off. Bought more afterwards and was briefly +$60.000. Sold after the squeeze with +$150........","https://i.redd.it/5qa8ximrs2h61.jpg"
1613148280,"chris2036","Made a Screenshot of when GME took off. Bought more afterwards and was briefly +$60.000. Sold after the squeeze with +$150..","https://i.redd.it/ry6hve7js2h61.jpg"
1613148142,"Extracheeeeeese","Hedge Fund managers after they squoze GME","https://www.reddit.com/r/wallstreetbets/comments/lieuxj/hedge_fund_managers_after_they_squoze_gme/"
1613148125,"Ebah31","Still holding strong with GME and SNDL boys 💪💪💪","https://i.redd.it/1raaipr1s2h61.jpg"
1613148117,"chris2036","Made a Screenshot of when GME took off. Bought more afterwards and was briefly +$60.000. Sold after the squeeze with +$150........","https://i.redd.it/4gjsvns1s2h61.jpg"
1613147854,"Ebah31","Still holding strong with GME and SNDL boys 💪💪💪","https://i.redd.it/a8mfkdd9r2h61.jpg"
1613147641,"Impossible_Sand3396","GME 2/12","https://www.reddit.com/r/wallstreetbets/comments/lieol5/gme_212/"
1613147110,"BagofBabbish","Current GME short interest per Bank of America Securities (don’t shoot the messenger)","https://i.redd.it/sh8pb622p2h61.jpg"
1613147054,"Klutzy_Impression_58","SELL YOUR GME SHARES NOW BOYS!","https://www.reddit.com/r/wallstreetbets/comments/lieh54/sell_your_gme_shares_now_boys/"
1613146955,"MrLanfrod","Is it still GME to the moon? Seems like the hype is dying! Is GME dead and do I need to stop lying to myself?","https://i.redd.it/9ufv4lhlo2h61.jpg"
1613146686,"Hippo_Desperate","what If SLV, WEED stocks and everything els is just a distraction from GME short squeeze. We need to stay together and fight one War at a time. Apes Together Strong 🦍 🦧💪🚀🚀 Also remember that there are still bots doing market manipulation in Reddit","https://i.redd.it/a08f57rsn2h61.jpg"
1613146658,"Hippo_Desperate","what If SLV, WEED stocks and everything els is just a distraction from GME short squeeze. We need to stay together and fight one War at a time. Apes Together Strong 🦍 🦧💪🚀🚀 Also remember that there are still bots doing market manipulation in Reddit","https://i.redd.it/kh0rq4ppn2h61.jpg"
1613146627,"mummiesfan06","GME SURGE!","https://www.reddit.com/r/wallstreetbets/comments/liebjo/gme_surge/"
1613146592,"aworldfullofshit","Fuck Weed, Hold GME","https://www.reddit.com/r/wallstreetbets/comments/lieb5y/fuck_weed_hold_gme/"
1613146384,"powerbutts","Why are options on GME closing only today? Has anyone experienced this with their brokers?","https://i.redd.it/tab7slcwm2h61.jpg"
1613146371,"Unusual_Tooth6611","GME 🙌🏽💎🦍","https://www.reddit.com/r/wallstreetbets/comments/lie8gt/gme/"
1613146244,"Hippo_Desperate","what If SLV, WEED stocks and everything els is just a distraction from GME short squeeze. We need to stay together and fight one War at a time. Apes Together Strong 🦍 🦧💪🚀🚀 Also remember that there are still bots doing market manipulation in Reddit","https://i.redd.it/wmi23mfhm2h61.jpg"
1613146100,"RejectKid89","$AXON yolo. Figured its safer than GME was since i lost a bunch","https://i.redd.it/5zwgh3e0m2h61.png"
1613146077,"Turbulent_Teacher_23","Hold fucking GME &amp; AMC let me tell you crayon eating apes why....","https://www.reddit.com/r/wallstreetbets/comments/lie4og/hold_fucking_gme_amc_let_me_tell_you_crayon/"
1613146029,"yupyup98765","No wonder Fidelity didn’t stop GME buying - they were the ones selling it.","https://i.redd.it/1cqmryeul2h61.jpg"
1613146012,"NIKSL20","GME $1000? BUT STOCK PRICE AND VOLUME TELLS A DIFFERENT STORY","https://www.youtube.com/watch?v=KUoYW3sfo6c"
1613145776,"clelwell","Legendary GME","https://i.redd.it/yv425tb3l2h61.jpg"
1613145565,"Plastic_Chicken","GME 2/12","https://www.reddit.com/r/wallstreetbets/comments/lidxtd/gme_212/"
1613145438,"valkener1","GME 2/12 thread","https://www.reddit.com/r/wallstreetbets/comments/lidwbk/gme_212_thread/"
1613145285,"RetroClubXYZ","GME 2/12","https://www.reddit.com/r/wallstreetbets/comments/lidugl/gme_212/"
1613145277,"JarlFlammen","Why is GME holding at $50 ?","https://www.reddit.com/r/wallstreetbets/comments/lidud9/why_is_gme_holding_at_50/"
1613145073,"Doggoonewild","GME major holder Vanguard dropping tweets 💎🙌","https://i.redd.it/up25fyzzi2h61.jpg"
1613144780,"casn10","Each one buy only one GME today!! Let's make it fun!","https://www.reddit.com/r/wallstreetbets/comments/lidobd/each_one_buy_only_one_gme_today_lets_make_it_fun/"
1613144538,"anonaccountttttt","GME executives missed on a lot of gains lol 🚀 🚀 🚀","https://www.reddit.com/gallery/lidl90"
1613144159,"whinnying_horse15","THE NEXT GME 🙌💎🚀? Who let the SHORTS out (again)? Palatin Technologies Inc. (PTN) known for 'female viagra' (FDA okay 2019) and international patent application for dry eye disease 2021. Good news, but stock now falling again?","https://www.reddit.com/r/wallstreetbets/comments/lidgg0/the_next_gme_who_let_the_shorts_out_again_palatin/"
1613144145,"zackd213","Holy Sh*t, idk if it’s going to the moon but we built a GME rocket ship.","https://i.redd.it/hu5808q8g2h61.jpg"
1613144087,"KodaTheeGreat","BUY GME","https://www.reddit.com/r/wallstreetbets/comments/lidfjn/buy_gme/"
1613143919,"AltoniusAmakiir","GME Small Spikes","https://www.reddit.com/r/wallstreetbets/comments/liddin/gme_small_spikes/"
1613143801,"tameryildiz","F ck WSB join GME","https://www.reddit.com/r/wallstreetbets/comments/lidbzh/f_ck_wsb_join_gme/"
1613143744,"DonPalme","Just YOLO'd my wifes bfs paycheck into GME","https://i.redd.it/bkeuix31f2h61.jpg"
1613143527,"WarriorxDad","GME or lotto ticket","https://www.reddit.com/r/wallstreetbets/comments/lid8n5/gme_or_lotto_ticket/"
1613143449,"Jowsh","How it feels to be holding GME","https://i.redd.it/8p4kv846e2h61.jpg"
1613143306,"Nojaja","Daily reminder that buying GME at 300 before 28/1 was a great play at the time.","https://www.reddit.com/r/wallstreetbets/comments/lid5uz/daily_reminder_that_buying_gme_at_300_before_281/"
1613143119,"baybyoda101","Bought GME at 102","https://www.reddit.com/r/wallstreetbets/comments/lid3e4/bought_gme_at_102/"
1613143077,"arashzad","What if we all buy 3 GME stocks in 1 day?","https://www.reddit.com/r/wallstreetbets/comments/lid2w5/what_if_we_all_buy_3_gme_stocks_in_1_day/"
1613142675,"AndRichard","I held GME like you told me. (I spent my birthday money on it) I’m here for my check. I also have Venmo and PayPal if that’s easier. Happy birthday to me?","https://www.reddit.com/r/wallstreetbets/comments/licxwo/i_held_gme_like_you_told_me_i_spent_my_birthday/"
1613142325,"AyyeDirtyHippie","GME AMC","https://www.reddit.com/r/wallstreetbets/comments/lictig/gme_amc/"
1613142273,"lifeaquatic34","Why is GME not dropping below $50?","https://www.reddit.com/r/wallstreetbets/comments/licsvk/why_is_gme_not_dropping_below_50/"
1613141984,"RatDog5","GME Megathread 2/13","https://www.reddit.com/r/wallstreetbets/comments/licor7/gme_megathread_213/"
1613141685,"Ok_Switch3976","GME Daily Discussion","https://www.reddit.com/r/wallstreetbets/comments/licl8u/gme_daily_discussion/"
1613141521,"ajwill0","After my recent ventures into GME and APHA","https://i.redd.it/w5mz7csf82h61.jpg"
1613141198,"Ok_Switch3976","GME Daily Discussion","https://www.reddit.com/r/wallstreetbets/comments/licfkk/gme_daily_discussion/"
1613141089,"ttwbb","Daily GME Discussion 12/2","https://www.reddit.com/r/wallstreetbets/comments/licedj/daily_gme_discussion_122/"
1613141061,"StopSelling_","GME MEGATHREAD 2/12/21","https://www.reddit.com/r/wallstreetbets/comments/lice0y/gme_megathread_21221/"
1613141010,"Unlucky1211","AMC and GME cannot be shorted with my broker in Mexico","https://i.redd.it/83j5n22x62h61.jpg"
1613140918,"[deleted]","GME MEGATHREAD 2/12/21","https://www.reddit.com/r/wallstreetbets/comments/liccfe/gme_megathread_21221/"
1613140844,"ODBandGarfunkel","GME Only Discussion February 12, 2021","https://www.reddit.com/r/wallstreetbets/comments/licbjh/gme_only_discussion_february_12_2021/"
1613140819,"LongLiveGEOTUS","When is GME going to pop?","https://www.reddit.com/r/wallstreetbets/comments/licb8f/when_is_gme_going_to_pop/"
1613140808,"endcapitalism666999","GME Thread 12/02/2021","https://www.reddit.com/r/wallstreetbets/comments/licb3r/gme_thread_12022021/"
1613140750,"Onboarding92","GME long. DFV had it right on the fundamentals in market context and still has it right.","https://www.reddit.com/r/wallstreetbets/comments/lhvzuq/gme_long_dfv_had_it_right_on_the_fundamentals_in/?utm_source=ifttt"
1613140669,"Resting_Traveler","GME Megathread 2/12","https://www.reddit.com/r/wallstreetbets/comments/lic9li/gme_megathread_212/"
1613140002,"soostrator123","Let's become this shit to the new GME 🚀🚀","https://i.redd.it/le42w2ax32h61.jpg"
1613139850,"Hassinennn","GME 2/12","https://www.reddit.com/r/wallstreetbets/comments/lic0g2/gme_212/"
1613139692,"Brubcha","GME AMC Merger","https://www.reddit.com/r/wallstreetbets/comments/libyp6/gme_amc_merger/"
1613139052,"StonkeyMonkey69","WHERE IS THE GME GANG?!?! 💎💎🦍🦍","https://www.reddit.com/r/wallstreetbets/comments/librrj/where_is_the_gme_gang/"
1613138581,"Hassinennn","GME 2/12","https://www.reddit.com/r/wallstreetbets/comments/libmeo/gme_212/"
1613137938,"Top-Cash-384","GME AMC TLRY","https://www.reddit.com/r/wallstreetbets/comments/libfa5/gme_amc_tlry/"
1613137806,"michael_dickless","GME gang migrate to r/WallStreetbetsELITE","https://www.reddit.com/r/wallstreetbets/comments/libdvm/gme_gang_migrate_to_rwallstreetbetselite/"
1613137731,"moonbear1990","GME implied volatility for Feb 26th. What does this mean?","https://www.reddit.com/r/wallstreetbets/comments/libd1q/gme_implied_volatility_for_feb_26th_what_does/"
1613137653,"Sushimanjohnson","GME","https://www.reddit.com/r/wallstreetbets/comments/libc9c/gme/"
1613137423,"momotradr","GME 150% was shorted, HIHI KYNC next?? They are over 200,000% shorted","https://www.reddit.com/r/wallstreetbets/comments/lib9x4/gme_150_was_shorted_hihi_kync_next_they_are_over/"
1613137185,"oosome","SNDL and a Warning to all Penny Stocks Futures, post GME hype","https://www.reddit.com/r/wallstreetbets/comments/lib7f1/sndl_and_a_warning_to_all_penny_stocks_futures/"
1613134863,"consciousnes5","Is GME undervalued atm?","https://i.redd.it/5pvkbrxmo1h61.jpg"
1613134729,"SnooCats6983","Do you still hold GME or looking for new stocks?","https://www.reddit.com/r/wallstreetbets/comments/liaivq/do_you_still_hold_gme_or_looking_for_new_stocks/"
1613134627,"vanvee01","GME and AMC","https://www.reddit.com/r/wallstreetbets/comments/liahy5/gme_and_amc/"
1613134529,"primo4343","I keep panic buying shares of GME","https://www.reddit.com/r/wallstreetbets/comments/liah2s/i_keep_panic_buying_shares_of_gme/"
1613134422,"clelwell","The Legend of GME","https://i.redd.it/wbzd25xbn1h61.jpg"
1613133470,"Joni_Barbosa","GME Time to for the second attack Apes! It's fu**** FRiDAY","https://www.reddit.com/r/wallstreetbets/comments/lia7jj/gme_time_to_for_the_second_attack_apes_its_fu/"
1613133456,"funkymallam","GME squeeze was a perfect example of how powerful the main street can be. Is time to call out the criminals on wall street. They should rot in jail. Can you imagine CNBC suggesting that retail traders should not be allowed to trade options? I hope there wishes never come through.","https://www.reddit.com/r/wallstreetbets/comments/lia7eb/gme_squeeze_was_a_perfect_example_of_how_powerful/"
1613133431,"i_just_want_2learn","Question: has this sub changed much from before the GME hoopla? (I didn’t join till after.)","https://www.reddit.com/r/wallstreetbets/comments/lia760/question_has_this_sub_changed_much_from_before/"
1613133314,"Djinnsesdjinns","GME with real nice middle finger","https://www.reddit.com/r/wallstreetbets/comments/lia65i/gme_with_real_nice_middle_finger/"
1613133206,"alexandrasimonsen","Are GME going to go up? Or should i sell","https://www.reddit.com/r/wallstreetbets/comments/lia54w/are_gme_going_to_go_up_or_should_i_sell/"
1613133048,"scatteam_djr","This could be another GME am i right? SONY to the Moon?🚀🚀🚀","https://i.redd.it/wnf57xt8j1h61.jpg"
1613132995,"scatteam_djr","This could be another GME am i right? SONY to the Moon🚀🚀🚀","https://i.redd.it/ujdf2a73j1h61.jpg"
1613131659,"a_vague_username","GME dd","https://www.reddit.com/r/wallstreetbets/comments/li9rsg/gme_dd/"
1613131620,"IncestuousDisgrace","GME IS OUT OF SHARES TO SHORT ! KEEP BUYING/HOLDING GUYS WERE WINNING ! 🚀🚀🚀🚀🚀🚀🚀🚀🚀🚀🚀🚀","https://i.redd.it/5qejytzze1h61.jpg"
1613130527,"Hychrome","Spineaway share costs actual 0.001€. Make it the next GME 🚀🌑 🚫🧢","https://i.redd.it/p96kaqpqb1h61.jpg"
1613129981,"DeepFvkcingValue","GME YOLO update — Feb 10 2021","https://i.redd.it/s0jcvjg4a1h61.jpg"
1613129933,"inigma1","WSB GME 💎🙌 🆚 Hedge Funds","https://youtu.be/PmNl0eMSY2k"
1613129680,"Jimmystocks888","Sharecare and Falcon Capital Acquisition Corp. Reach Agreement to Combine, Creating Publicly Traded Digital Health Company $MARK $TLRY $ GME $CTRM","https://www.prnewswire.com/news-releases/sharecare-and-falcon-capital-acquisition-corp-reach-agreement-to-combine-creating-publicly-traded-digital-health-company-301227530.html"
1613129288,"Shark-777-USA","AMC and GME holders, Revoke the permission to use your ( AMC, GME) all shares!!!","https://www.reddit.com/r/wallstreetbets/comments/li985b/amc_and_gme_holders_revoke_the_permission_to_use/"
1613129091,"blinis35","Get your refund from GME -&gt; XLM and XRP are on fire! 💥","https://www.reddit.com/r/wallstreetbets/comments/li96jv/get_your_refund_from_gme_xlm_and_xrp_are_on_fire/"
1613128786,"JohnnyCas2031","GME still holding...... it will comeback eventually. I think to at least 100. I’m sure. Very sure.","https://www.reddit.com/r/wallstreetbets/comments/li945e/gme_still_holding_it_will_comeback_eventually_i/"
1613128607,"StudentTamino","GME Stock, Naked Shorts and Reddit Family opposing ""Apex"" Wallstreet Hedgefunds","https://www.reddit.com/r/wallstreetbets/comments/li92pw/gme_stock_naked_shorts_and_reddit_family_opposing/"
1613128501,"Fjantegeden","GME falling to the ground?","https://www.reddit.com/r/wallstreetbets/comments/li91ua/gme_falling_to_the_ground/"
1613127728,"Passenger_Humble","Ccrc. Low float, Chinese stocks are moving since Biden’s win! Up 25% in last month! Possibly the next GME with real value!","https://www.reddit.com/r/wallstreetbets/comments/li8vl3/ccrc_low_float_chinese_stocks_are_moving_since/"
1613127527,"thabat","If GME hits 10k I'll pay an artist to depict this entire moment in history in a sleeve tattoo","https://www.reddit.com/r/wallstreetbets/comments/li8tlm/if_gme_hits_10k_ill_pay_an_artist_to_depict_this/"
1613127009,"StickyRick33","Buy more GME","https://www.reddit.com/r/wallstreetbets/comments/li8pq7/buy_more_gme/"
1613125522,"lugenfabrik","PSA for (noob) GME hodlers who lost big and dont know what to do","https://www.reddit.com/r/wallstreetbets/comments/li8ebz/psa_for_noob_gme_hodlers_who_lost_big_and_dont/"
1613124607,"waIIsreetfighter","AMC GME to OTC $$$","https://www.reddit.com/r/wallstreetbets/comments/li877x/amc_gme_to_otc/"
1613123692,"Admiral_prowarrior","GME is best place to invest . 👌","https://i.redd.it/xw681z7fr0h61.jpg"
1613123634,"GodTaner","The paper hands who talked shit about GME are now bag holding Weed stocks like the morons they are","https://www.reddit.com/r/wallstreetbets/comments/li7zfh/the_paper_hands_who_talked_shit_about_gme_are_now/"
1613123589,"TheWhackBateman","Were GME Shorts covering between Jan22 and Jan 27?","https://www.reddit.com/r/wallstreetbets/comments/li7z1s/were_gme_shorts_covering_between_jan22_and_jan_27/"
