"created_utc","author","title","url"
1613602081,"Cool-Cookies","I need more GME 🤤","https://www.reddit.com/r/wallstreetbets/comments/lm6y98/i_need_more_gme/"
1613601713,"portapady","Wall Street Journal called GME stocks rise 'stratospheric' WSB took it to the moon!","https://i.redd.it/kldafoit84i61.jpg"
1613601583,"Onboarding92","Here you go you dicks. Still holding GME like a proud monkey.","https://www.reddit.com/r/wallstreetbets/comments/llxh41/here_you_go_you_dicks_still_holding_gme_like_a/?utm_source=ifttt"
1613601548,"house_lover6","This was just the ad I needed to see today, still holding GME and AME🚀🚀💎💎","https://i.redd.it/nl1ll63c84i61.jpg"
1613601138,"Rolltide-tolietpaper","What if, Congress is the catalyst for the next GME rocket","https://www.reddit.com/r/wallstreetbets/comments/lm6m5c/what_if_congress_is_the_catalyst_for_the_next_gme/"
1613600888,"Thin_Influence5878","Melvin just LIED in federal hearing about GME","https://www.teletrader.com/melvins-plotkin-defends-short-selling-in-federal-hearing/news/details/54654691?internal=1"
1613600811,"Thin_Influence5878","Melvin just LIED during the federal hearing about GME","https://www.reddit.com/r/wallstreetbets/comments/lm6hv3/melvin_just_lied_during_the_federal_hearing_about/"
1613600702,"Thin_Influence5878","Melvin just LIED in a federal hearing about GME","https://www.reddit.com/r/wallstreetbets/comments/lm6gf4/melvin_just_lied_in_a_federal_hearing_about_gme/"
1613599586,"FeintLight123","Could this trial effect GME price?","https://www.reddit.com/r/wallstreetbets/comments/lm61so/could_this_trial_effect_gme_price/"
1613599494,"Magski","DFV Testimony = WSB support + Buy GME !!!","https://www.reddit.com/r/wallstreetbets/comments/lm60mr/dfv_testimony_wsb_support_buy_gme/"
1613597112,"YeetStation69","Is GME dead?","https://www.reddit.com/r/wallstreetbets/comments/lm54id/is_gme_dead/"
1613596710,"mf_paint","Can we get a GME mega thread tomorrow?","https://www.reddit.com/r/wallstreetbets/comments/lm4z97/can_we_get_a_gme_mega_thread_tomorrow/"
1613596639,"FireHunterSD","Was behind this guy on the way to work this morning. This is a sign my fellow retardapes! GME GONNA HIT $2590 🤑🤑🎊🎉😂","https://i.redd.it/mkjtldeqt3i61.jpg"
1613595883,"slippi89","GME Needs Panini’s","https://www.reddit.com/r/wallstreetbets/comments/lm4nyq/gme_needs_paninis/"
1613595649,"LifeArtas","Proud retard here, put all my meagre savings into AMC and GME 💎✋","https://i.redd.it/g0nf4sisq3i61.png"
1613595544,"thisonedudeyouknow","SOLD ALL OF MY GME","https://www.reddit.com/r/wallstreetbets/comments/lm4iwa/sold_all_of_my_gme/"
1613595320,"thisonedudeyouknow","SOLD ALL OF MY GME","https://www.reddit.com/r/wallstreetbets/comments/lm4fus/sold_all_of_my_gme/"
1613595152,"loose-ventures","DFV opines on the GME situation","https://i.redd.it/xe37siebp3i61.jpg"
1613594806,"Lord_Emerion","According to an article from CNBC, DFV is still bullish on GME","https://i.imgur.com/eWJiQwg.jpg"
1613594750,"DeprivedLondorian","🌈🐻 angry about GME sues DFV, forgets that big positions = big risks. Sources say plaintiff does not have loss porn fetish","https://www.polygon.com/2021/2/17/22287804/gamestop-stock-price-lawsuit-roaring-kitty-reddit-robinhood"
1613594563,"whatslifeforfr","DEEP FUCKING VALUE “BULLISH AS EVER” ON GME","https://www.reddit.com/r/wallstreetbets/comments/lm454b/deep_fucking_value_bullish_as_ever_on_gme/"
1613594374,"loose-ventures","DFV releases his testimony and shares his feelings about the whole GME situation","https://i.redd.it/fan24j20n3i61.jpg"
1613593766,"BatsArentFood","ALL YOU APES THAT MADE TENDIES FROM GME - LETS CROWDFUND DFV'S LEGAL DEFENSE","https://www.reddit.com/r/wallstreetbets/comments/lm3udk/all_you_apes_that_made_tendies_from_gme_lets/"
1613593262,"dirtykras","I bought GME at 190. Is the rocket coming back???","https://www.reddit.com/r/wallstreetbets/comments/lm3nsr/i_bought_gme_at_190_is_the_rocket_coming_back/"
1613593213,"Canihaveastrawplease","Keith Gill on GME testimony... This hits deep...Pulling for him tomorrow","https://www.reddit.com/gallery/lm3n5u"
1613593006,"masterkoster","GME Average 76% down 18 year old student. Not much but its mine. Still holding!","https://i.redd.it/6q4ce0mxi3i61.jpg"
1613592948,"Sam-Morteza","Next GME","https://www.reddit.com/r/wallstreetbets/comments/lm3jol/next_gme/"
1613592940,"DaylightTonight","DFV - Tomorrow's info today - The most important part of tomorrow's congressional testimony. GME is undervalued🚀🚀🚀","https://i.redd.it/70wvh7ypi3i61.jpg"
1613592624,"masterkoster","GME Average 76% down 18 year old student. Not much but its mine. Still holding!","https://i.redd.it/01htg2rsh3i61.jpg"
1613592501,"CherryComputer","When you just got married but GME starts going to the Moon 🚀🚀🚀🌝","https://i.redd.it/6nzizuhfh3i61.jpg"
1613591731,"JustTellMeTheFacts","I bought GME because Jim Cramer liked the stock. No other reason or person's involved.","https://www.reddit.com/r/wallstreetbets/comments/lm3352/i_bought_gme_because_jim_cramer_liked_the_stock/"
1613591660,"leninwasjesus","Is there a magic number GME needs to stay above?","https://www.reddit.com/r/wallstreetbets/comments/lm328k/is_there_a_magic_number_gme_needs_to_stay_above/"
1613591444,"Jasper7102","GME 🚀 🚀🚀🚀🚀🚀🚀GME","https://www.reddit.com/r/wallstreetbets/comments/lm2zdl/gme_gme/"
1613590899,"LunarExplorer19","DFV being sued for securities fraud related to the GME incident","https://i.redd.it/0gx6yn4oc3i61.jpg"
1613590441,"SheepSlapper","GME YOLO from $70k -&gt; $1M. 2,700 shares, held for 2 months. Two commas feels good 🚀🚀🚀","https://i.imgur.com/T2QBq4D.png"
1613590132,"paulosellos","Still GME retarded","https://www.reddit.com/r/wallstreetbets/comments/lm2i1r/still_gme_retarded/"
1613590042,"0HVYNT0","Finally down on GME 😍","https://i.redd.it/aazzohk3a3i61.jpg"
1613589973,"andrewnicebody","Help me choose a place to give away part of my GME gains","https://www.reddit.com/r/wallstreetbets/comments/lm2fyd/help_me_choose_a_place_to_give_away_part_of_my/"
1613589674,"jkingcrow21","Borrowed 31K from my 401K and 10K from parents. Turned on margin and maxed it out on GME shares. Who’s retarded now - Update","https://www.reddit.com/gallery/lm2byw"
1613589193,"baturu","Illegal Tactics and DTCC/Prime Broker Complicity In Naked Shorting &amp; Retail Shutdown of GME (Read Ahead of 2/18 GameStop Congress Hearing) *Reposting for Visibility*","https://www.reddit.com/r/wallstreetbets/comments/lm25ot/illegal_tactics_and_dtccprime_broker_complicity/"
1613588382,"DetectiveDamien","Here you punks go. Lost my entire portfolio to GME and Weed Stonks","https://www.reddit.com/r/wallstreetbets/comments/lm1ual/here_you_punks_go_lost_my_entire_portfolio_to_gme/"
1613588235,"Infinite_Newspaper69","Capitol Hill Takes on GME","https://i.redd.it/c2z5w2yq43i61.jpg"
1613588016,"i_need_too_know","GME TRIAL-TRANSFER FROM ROBIN TO WEBULL BEFORE OR AFTER?","https://www.reddit.com/r/wallstreetbets/comments/lm1pbg/gme_trialtransfer_from_robin_to_webull_before_or/"
1613587222,"not_wall03","GME is doing the 'Human' trend... The belly should come up soon! TO THE MOON AND BEYOND!! 🚀🚀🚀🚀","https://i.redd.it/iisxwxy913i61.png"
1613586885,"msquared_ita","DFV sued for security fraud over GME rise","https://www.reddit.com/r/wallstreetbets/comments/lm1a7u/dfv_sued_for_security_fraud_over_gme_rise/"
1613586043,"AllOrNothing69M","The next GME","https://www.reddit.com/r/wallstreetbets/comments/lm0yqy/the_next_gme/"
1613585980,"CadsuaneSedai","GME Stockholders: You have rights that are at risk. It happened last year and it can happen again. Per the By-Laws, we can begin the process of calling in shares now.","https://www.reddit.com/r/wallstreetbets/comments/lm0xty/gme_stockholders_you_have_rights_that_are_at_risk/"
1613585959,"Tokiyoka","GME HOLDERS","https://www.reddit.com/r/wallstreetbets/comments/lm0xjp/gme_holders/"
1613585763,"SnooWalruses7854","GME AMC LOSS PORN GUH","https://i.redd.it/mtrjkgdex2i61.jpg"
1613585573,"ChickenNuggetsToMoon","Which vehicle is on the moon after GME takes off? 🚀","https://www.reddit.com/r/wallstreetbets/comments/lm0s9m/which_vehicle_is_on_the_moon_after_gme_takes_off/"
1613585569,"FatAspirations","GME - EndGame part 6: The Big Reset, or The Greatest Financial Crime of the Century - and how to play GME going forward","https://www.reddit.com/r/wallstreetbets/comments/lm0s6v/gme_endgame_part_6_the_big_reset_or_the_greatest/"
1613585146,"FatAspirations","GME - EndGame part 6: The Big Reset, or The Greatest Financial Crime of the Century - and how to play GME going forward","https://www.reddit.com/r/wallstreetbets/comments/lm0m1s/gme_endgame_part_6_the_big_reset_or_the_greatest/"
1613584363,"apianti","There are 200K GME shares bid at $0.0001 driving the price down, yes, that is 1/100 of a penny","https://i.redd.it/2byeckd8t2i61.png"
1613584315,"MyGirlGaveMeJamon","For the retards who want to follow the GME hearing live","https://youtu.be/RfEuNHVPc_k"
1613583971,"MatterEntire3475","GME over?","https://www.reddit.com/r/wallstreetbets/comments/lm05co/gme_over/"
1613553843,"CookingGreatStocks","getting wet bought GME at the top of 480$ anyone paid more? STILL HOLDING THE LINE WE LIKE THE STOCK 🚀🚀🚀🌑🌑","https://www.reddit.com/r/wallstreetbets/comments/llqj5c/getting_wet_bought_gme_at_the_top_of_480_anyone/"
1613549226,"MTBDEM","Even the UK weathergirl knows about GME","https://i.imgur.com/s8TxYmG.jpg"
1613548284,"piraattipate","gamestop.com is down for 24 hours already 🤔 GME is limited company - how is this possible? What is happening?","https://i.redd.it/kjz8bf1ytzh61.jpg"
1613547054,"FlyParticular8043","My girlfriend agreed to sell nudes to everyone holding GME and AMC to support the apes mentally ( I am not kidding 😂)","https://www.reddit.com/r/wallstreetbets/comments/llov2r/my_girlfriend_agreed_to_sell_nudes_to_everyone/"
1613544364,"No_Butterscotch9429","GME - $$$","https://www.reddit.com/r/wallstreetbets/comments/llo7dr/gme/"
1613543641,"navneet2709","I heard people are looking for some GME loss porn. 💎👐","https://i.redd.it/5rs4g0c5gzh61.jpg"
1613543176,"fshuda","NEWS: Class Action Lawsuit against Hedge Funds. GME holders can be a part of it.","https://i.redd.it/h0ooteirezh61.jpg"
1613542787,"shoeman25","GME loss - 15k+","https://www.reddit.com/gallery/llnt4q"
1613514649,"TECHOMEGA86","WSB please stop deleting posts/comments that support GME and AMC. SEC/Congressmen have been notified","https://www.reddit.com/gallery/llffow"
1613514044,"Portal2TheMoon","Citadel, Melvin Capitol, Robinhood, Reddit, and user DeepFuckingValue are set to testify thursday at noon on the GME event that has been unfolding for the past weeks.","https://www.marketwatch.com/story/heres-what-to-expect-at-the-congressional-hearings-on-gamestop-and-robinhood-11613511018?mod=newsviewer_click"
1613513918,"Ndifel","The Wisdom of GME","https://v.redd.it/b7j1iezcywh61"
1613513659,"Portal2TheMoon","Melvin capital, citadel, reddit, robinhood, and u/DeepFuckingValue set to testify on GME thursday at 12:00 noon","https://www.reddit.com/r/wallstreetbets/comments/llf3io/melvin_capital_citadel_reddit_robinhood_and/"
1613513654,"Portal2TheMoon","Melvin capital, citadel, reddit, robinhood, and u/DeepFuckingValue set to testify on GME thursday at 12:00 noon","https://www.reddit.com/r/wallstreetbets/comments/llf3h4/melvin_capital_citadel_reddit_robinhood_and/"
1613512452,"Chubuscus__83","Bought Both the top of GME and Weed Stonks, plummeted 5k, here's to a moonshot before I lose the rest.","https://i.redd.it/abr77fkevwh61.jpg"
1613511919,"MrjasonAdair","Come to Rkt like we did GME","https://www.reddit.com/r/wallstreetbets/comments/llehqm/come_to_rkt_like_we_did_gme/"
1613511642,"Fatmangotmypie","Watching GME and AMC dip again.","https://v.redd.it/q149kqnwswh61"
1613511474,"earache2255","Invested my entire IRA into $GME at $330. At this point I'm holding until retirement (60ish years likely) or GME hits the moooooonnn 🚀🚀🚀🚀","https://i.redd.it/ywxrs8zhswh61.jpg"
1613511060,"whatasuperdude","I knew GME felt a little off...","https://i.redd.it/nvqn02j9rwh61.jpg"
1613509949,"Stonky_Maximus973","A long read but well worth it for us GME apes","https://www.reddit.com/r/wallstreetbets/comments/lldset/a_long_read_but_well_worth_it_for_us_gme_apes/"
1613509942,"Stonky_Maximus973","A long read but well worth it for us GME apes","https://www.reddit.com/r/wallstreetbets/comments/lldsbf/a_long_read_but_well_worth_it_for_us_gme_apes/"
1613509447,"AlexLoverOMG","From a Bloomberg terminal. More proof the GME squeeze nearly came to a market shaking event before the taps were turned off, and that the hedgies are still stuck.","https://i.redd.it/so4i10icmwh61.png"
1613509373,"TheRealSkyboy","Feeling pretty good. And yes, I’m holding my 1 fucking GME till moon or die, which ever comes first. Let’s go! 🔥✋","https://i.redd.it/upv1thz8mwh61.jpg"
1613509238,"TheRealSkyboy","Feelin pretty good about all these. And yes, I’m holding my 1 fucking GME till moon or die, which ever comes first. Let’s go! 🔥✋","https://i.redd.it/atg7llmulwh61.jpg"
1613508483,"shamelesstrep","Im curious, how many GME involved were EMPLOYED vs UNEMPLOYED?","https://www.reddit.com/r/wallstreetbets/comments/lld8tt/im_curious_how_many_gme_involved_were_employed_vs/"
1613508247,"markdegroot","The criminals that took GME down 371 points (77%) with only 8 million shares should rot in jail","https://www.reddit.com/r/options/comments/l7mym2/the_criminals_that_took_gme_down_371_points_77/"
1613508236,"trizuschrist","Maverick Capital x GME Stonks","https://www.reddit.com/r/wallstreetbets/comments/lld5o0/maverick_capital_x_gme_stonks/"
1613508078,"mightysox","Transfer from ""Cash"" account on Robinhood to Vanguard shows GME and AMC were purchased on Margin...","https://www.reddit.com/r/wallstreetbets/comments/lld3k2/transfer_from_cash_account_on_robinhood_to/"
1613507362,"Janto_2021","Maverick Capital Boosted stake in GME to nearly 7%","https://i.redd.it/0orefvt9gwh61.jpg"
1613507205,"DarthShortSqueeze","BC touched 50k today. mining is 🔥. MARA and RIOT are expensive but strong. A lot of ground floor entry points in SOS, INTV and ARBKF. I’m holding AMC and GME long and I like the stock but I love the others more. Anyone else have suggestions for mining stocks?","https://i.redd.it/ypuj2wssfwh61.jpg"
1613482419,"holoscenes","The mainstream media is trying to distract us with GME and shitcoin but it’s all just a distraction from the real future of this sub. Leaf gang🍁🍁🍁","https://i.redd.it/nmtderp3euh61.jpg"
1613480799,"old-users","Buying GME at 300 before 28/1 was a great play at the time.","https://www.reddit.com/r/wallstreetbets/comments/ll3f2x/buying_gme_at_300_before_281_was_a_great_play_at/"
1613480552,"TheGuyW2","Anyone else getting spammed from Yahoo Finance on why GME bad and should sell?","https://www.reddit.com/r/wallstreetbets/comments/ll3ckb/anyone_else_getting_spammed_from_yahoo_finance_on/"
1613480204,"TechnicianTop931","GME LOST PORN","https://www.reddit.com/r/wallstreetbets/comments/ll38uw/gme_lost_porn/"
1613479372,"StrangeRemark","GME bagholder finds some irregularities...","https://gfycat.com/colorlessshamelessiberianmidwifetoad"
1613478116,"Pepe3100","Currently holding 19 shares of GME and I’m planning on buying $800 of shares when the market opens GME to the Moon Diamond Hands Baby 💎🙌 (also can y’all go listen to my friends song on YT get him to 1k views and I’ll make him buy GME shares) 🙏","https://i.redd.it/b8w6kh3b1uh61.jpg"
1613477461,"fixie321","XRT which has a large GME volume is being shorted at 180.67%","https://i.redd.it/qf1vpkyczth61.png"
1613475613,"shimiyayomomgay","I'm sorry, I'm a noob but is GME going to go up again? I'm still holding","https://www.reddit.com/r/wallstreetbets/comments/ll22xp/im_sorry_im_a_noob_but_is_gme_going_to_go_up/"
1613474885,"CaptainLisaSu","Similarities between AMD's rise and GME mania","https://www.reddit.com/r/wallstreetbets/comments/ll1wqf/similarities_between_amds_rise_and_gme_mania/"
1613474239,"Weesy02","German Ex-hedgefond talks about GME and the infiltration of WSB","https://www.reddit.com/r/wallstreetbets/comments/ll1rj4/german_exhedgefond_talks_about_gme_and_the/"
1613474167,"Weesy02","German Ex-hedgefond talks about GME and infiltration of WSB","https://www.youtube.com/watch?v=u0MqAicvv6M"
1613473312,"Captainquizzical","Instead of people getting constantly mad at posts regarding ""meme stocks"" like GME and AMC, why don't mods try to have a specific day/days where posts that mention them are moderated to a minimim?","https://www.reddit.com/r/wallstreetbets/comments/ll1jo1/instead_of_people_getting_constantly_mad_at_posts/"
1613472421,"proactive-defense","Dear Noobs: how you could have anticipated the crash of GME and not lost 80%","https://www.reddit.com/r/wallstreetbets/comments/ll1cct/dear_noobs_how_you_could_have_anticipated_the/"
1613471903,"Taxed1122","GME TO THE MOON!! YOU HEDGIES ARE BEYOND Screwed!!! Hahahaha","https://www.reddit.com/r/wallstreetbets/comments/ll18bg/gme_to_the_moon_you_hedgies_are_beyond_screwed/"
1613470937,"ManufacturerNew4873","Everyones still holding right? GME","https://www.reddit.com/r/wallstreetbets/comments/ll10sa/everyones_still_holding_right_gme/"
1613470033,"UrmaConstellation","GME won’t ever cross $100 - we all got fooled","https://www.reddit.com/r/wallstreetbets/comments/ll0ts7/gme_wont_ever_cross_100_we_all_got_fooled/"
1613469362,"toutoucnc","Need explanations on level 2 data for GME","https://www.reddit.com/r/wallstreetbets/comments/ll0oes/need_explanations_on_level_2_data_for_gme/"
1613467866,"Chacky_stocks","SAS = GME","https://www.reddit.com/r/wallstreetbets/comments/ll0d5c/sas_gme/"
1613464546,"Alien1688","Show is over for GME and AMC? What happened to all the posts and analysis?","https://www.reddit.com/r/wallstreetbets/comments/lkzmms/show_is_over_for_gme_and_amc_what_happened_to_all/"
1613463477,"GotenXx","XRT is being used to Hide GME Shorts","https://www.reddit.com/r/wallstreetbets/comments/lkzdxt/xrt_is_being_used_to_hide_gme_shorts/"
1613463219,"fadisaleh","Robinhood Cofounder discussing GME with former SEC Chairman in one week","https://i.redd.it/ypky3ucxssh61.png"
1613463125,"fadisaleh","Robinhood Cofounder discussing GME with former SEC Chairman in one week","https://i.redd.it/ekfpytknssh61.png"
1613457941,"FelixTheGreatOne","Get your GME money back","https://www.reddit.com/r/wallstreetbets/comments/lky2oe/get_your_gme_money_back/"
1613457568,"Onboarding92","GME Should Go Bankrupt","https://www.reddit.com/r/wallstreetbets/comments/lktele/gme_should_go_bankrupt/?utm_source=ifttt"
1613455534,"violetchampagne","For all my fellow retards out there still holding GME is this Jim Cramer or Donye Wimp??","https://i.redd.it/xknqwjb56sh61.png"
1613455280,"momolenfoire224","To my GME folks","https://www.instagram.com/reel/CLNGUM4jyfb/?igshid=igmmfsc3zq4j"
1613454751,"DueDillie","AI generated DD for GME - says don't buy it - sorry.. love the movement, but... Its expensive; profitability is close to weak; street sentiment is close to a push; momentum is obliviously at a ridiculously high score but its a bubble.. survey says:","https://i.redd.it/uslkx9gr3sh61.png"
1613454676,"ZaddyPowell69","“Trust me bro, GME 800C can not go tits up. Yes, mortgage your wife’s bf’s house”","https://i.redd.it/fdnanbzl3sh61.jpg"
1613454542,"DueDillie","AI generated DD for GME - says don't buy it - sorry.. love the movement, but... Its expensive; profitability is close to weak; street sentiment is close to a push; momentum is obliviously at a ridiculously high score but its a bubble.. survey says:","https://i.redd.it/e7ecigkk1sh61.png"
1613454310,"Rick_Perrys_Asshole","You thought this was Game of Markets, turns out it is just Hunger Games STONKS SAGA! How Citadel &amp; RH fucked over the GME squeeze by changing the rules of the game and no one gives a fuck about it and why Mark Cuban is RIGHT!","https://www.reddit.com/r/wallstreetbets/comments/lkx41j/you_thought_this_was_game_of_markets_turns_out_it/"
1613452327,"kychui2323","GME day to moon","https://www.reddit.com/r/wallstreetbets/comments/lkwkfj/gme_day_to_moon/"
1613452284,"kychui2323","GME day to moon","https://www.reddit.com/r/wallstreetbets/comments/lkwjyy/gme_day_to_moon/"
1613452121,"ZebstrikaMD","You can’t buy these street smarts, and the government won’t be taxing my three shares of $215-300 GME 💎 🚀 😂","https://i.redd.it/1l2pl6f0wrh61.jpg"
1613449415,"HugeNuge0","GME to the moon 🖐💎🤚","https://www.reddit.com/r/wallstreetbets/comments/lkvpiz/gme_to_the_moon/"
1613449308,"HugeNuge0","XRT is being used to hide GME shorts. XRT currently sits at 190% SHORT FLOAT. Peaking on 2/1 at over 800% SHORT FLOAT!!","https://www.reddit.com/r/GME/comments/lknjkc/xrt_is_being_used_to_hide_gme_shorts_xrt/?utm_source=share&amp;utm_medium=ios_app&amp;utm_name=iossmf"
1613448729,"watchthegaps","Mods are asleep, frontpage GME posts","https://www.reddit.com/r/wallstreetbets/comments/lkvhy9/mods_are_asleep_frontpage_gme_posts/"
1613448489,"RepresentativeIll627","WE ARE IN CONTROL. 🚀 WE HOLD THE AMMO BABY GME TO THE MOON","https://i.redd.it/eiwa6kn7lrh61.jpg"
1613448479,"watchthegaps","Mods are asleep, frontpage all GME posts","https://www.reddit.com/r/wallstreetbets/comments/lkvf5q/mods_are_asleep_frontpage_all_gme_posts/"
1613448160,"[deleted]","Is XRT is being used to hide GME shorts?","https://www.reddit.com/r/wallstreetbets/comments/lkvbrz/is_xrt_is_being_used_to_hide_gme_shorts/"
1613447963,"Dazzling-Crowuuuuu","About GME doom day and welcome to discuss","https://www.reddit.com/r/wallstreetbets/comments/lkv9ev/about_gme_doom_day_and_welcome_to_discuss/"
1613447485,"[deleted]","Help!? Should I sell my GME STOCK BEFORE I LOSE MORE $ OR HOLD?","https://www.reddit.com/r/wallstreetbets/comments/lkv45q/help_should_i_sell_my_gme_stock_before_i_lose/"
1613446942,"Bornandbread1","GME + AMC Partnership? Is it possible?","https://www.reddit.com/r/wallstreetbets/comments/lkuynq/gme_amc_partnership_is_it_possible/"
1613446712,"djroy32","$$GAMR$$ is the ETF that has the most GME stock in it!","https://www.reddit.com/r/wallstreetbets/comments/lkuw3w/gamr_is_the_etf_that_has_the_most_gme_stock_in_it/"
1613446648,"djroy32","$GAMR$ is the ETF that has the most GME stock in it!","https://www.reddit.com/r/wallstreetbets/comments/lkuvd1/gamr_is_the_etf_that_has_the_most_gme_stock_in_it/"
1613446545,"djroy32","GAMR is the ETF that has the most GME stock in it!","https://www.reddit.com/r/wallstreetbets/comments/lkutrk/gamr_is_the_etf_that_has_the_most_gme_stock_in_it/"
1613446467,"djroy32","GAMR is the ETF that has the most GME stock in it!","https://www.reddit.com/r/wallstreetbets/comments/lkuswb/gamr_is_the_etf_that_has_the_most_gme_stock_in_it/"
1613446313,"Dazzling-Crowuuuuu","Short volume and GME day to 🚀","https://www.reddit.com/r/wallstreetbets/comments/lkur7k/short_volume_and_gme_day_to/"
1613446267,"Dazzling-Crowuuuuu","About GME shorting HF doom day - welcome to discuss","https://www.reddit.com/r/wallstreetbets/comments/lkuqp6/about_gme_shorting_hf_doom_day_welcome_to_discuss/"
1613443702,"saliym1988","XRT is being used to hide GME shorts. XRT currently sits at 190% SHORT FLOAT. Peaking on 2/1 at over 800% SHORT FLOAT!!","https://www.reddit.com/r/wallstreetbets/comments/lktxjx/xrt_is_being_used_to_hide_gme_shorts_xrt/"
1613443603,"[deleted]","XRT is being used to hide GME shorts. XRT currently sits at 190% SHORT FLOAT. Peaking on 2/1 at over 800% SHORT FLOAT!!","https://www.reddit.com/r/wallstreetbets/comments/lktwjj/xrt_is_being_used_to_hide_gme_shorts_xrt/"
1613443573,"dankantspelle","155 shares of GME at an avg cost of $242 per. Down over 28k in 28 days.","https://i.redd.it/38bwbpcl6rh61.jpg"
1613443199,"--X0X0--","is XRT is being used to hide GME shorts?","https://www.reddit.com/r/wallstreetbets/comments/lktrhe/is_xrt_is_being_used_to_hide_gme_shorts/"
1613443052,"felix45","XRT shorted 180%, Has a large volume of GME","https://i.redd.it/kj38kplf6qh61.png"
1613442836,"MrSir89","Why is GME staying around $50?","https://www.reddit.com/r/wallstreetbets/comments/lktnjt/why_is_gme_staying_around_50/"
1613442782,"17thgreen","XRT is being used to hide GME shorts. XRT currently sits at 190% SHORT FLOAT. Peaking on 2/1 at over 800% SHORT FLOAT!!","https://www.reddit.com/r/wallstreetbets/comments/lktmxy/xrt_is_being_used_to_hide_gme_shorts_xrt/"
1613442598,"Infected_melody","GME dead?","https://www.reddit.com/r/wallstreetbets/comments/lktkzn/gme_dead/"
1613442303,"[deleted]","Is GME getting shorted by proxy?","https://www.reddit.com/r/wallstreetbets/comments/lkthyv/is_gme_getting_shorted_by_proxy/"
1613442234,"realaccountforsure","I'm diamond handing $37k of GME already. Is there anything else worth YOLOing money into first thing tomorrow?","https://www.reddit.com/r/wallstreetbets/comments/lkth85/im_diamond_handing_37k_of_gme_already_is_there/"
1613442004,"new-age-phobia","Fellow Apes, I'm engraving GME to the moon in my graveyard. But ain't fkn selling. 💎 🙌","https://i.redd.it/z6ep5tex1rh61.jpg"
1613441999,"this_is_trash_really","GME Should Go Bankrupt","https://www.reddit.com/r/wallstreetbets/comments/lktele/gme_should_go_bankrupt/"
1613441772,"Sofa_king_disco","GME holders, don't get discouraged","https://www.reddit.com/r/wallstreetbets/comments/lktc6b/gme_holders_dont_get_discouraged/"
1613441411,"Arod4774","Where my by holders at??? GME at $350. Sorry about the low quality, i should be studying.","https://v.redd.it/mhgx0qazzqh61"
