"created_utc","author","title","url"
1612857355,"DiamondHandDemon","CAN SOMEONE EXPLAIN THIS?? February 8th, 2021 GME &amp; AMC SPIKED (GME:..$293 + AMC:...$16.50) IF YOU THINK THIS IS PHOTOSHOP, GO TO “NASDAQ.COM” &amp; LOOK AT GME &amp; AMC “REAL-TIME” on 02/08/2021 💎💎✋🏽✋🏽HOLD THE LINE💎💎✋🏽💎🚀TO THE MOON AND BEYOND✋🏽💎🚀","https://www.reddit.com/gallery/lfxnio"
1612857332,"Alexander_koslov","THIS IS ALL YOU NEED TO KNOW ABOUT GME - Most important information by Far (Short Sqeeuze) see youtube link below 🙏🏻🙏🏻","https://www.reddit.com/r/wallstreetbets/comments/lfxncy/this_is_all_you_need_to_know_about_gme_most/"
1612857082,"nunuplane","Free PS5 from GME for everyone who hodl for more than 30 days.","https://www.reddit.com/r/wallstreetbets/comments/lfxle9/free_ps5_from_gme_for_everyone_who_hodl_for_more/"
1612855426,"269898","Let's go for GME again","https://www.reddit.com/r/wallstreetbets/comments/lfx872/lets_go_for_gme_again/"
1612855410,"dahoody","Should I buy GME stock now?","https://www.reddit.com/r/wallstreetbets/comments/lfx82o/should_i_buy_gme_stock_now/"
1612854818,"AlphaTangoCheesecake","GME @ $293?? CAN SOMEONE EXPLAIN WHATS GOING ON","https://i.redd.it/evdkyc7xjeg61.jpg"
1612854797,"JanPillermannOtze","GME @ 293$?!","https://www.reddit.com/r/wallstreetbets/comments/lfx33v/gme_293/"
1612854400,"Strong_hold_7723","GME to the moon!","https://www.reddit.com/r/wallstreetbets/comments/lfwzqn/gme_to_the_moon/"
1612854346,"Strong_hold_7723","GME to the moon!","https://www.reddit.com/r/wallstreetbets/comments/lfwz95/gme_to_the_moon/"
1612854290,"Grand_Barnacle_6922","GME 13D Filing Please Upvote!","https://i.redd.it/6agu6adcieg61.png"
1612854253,"Grand_Barnacle_6922","GME 13D filing PLEASE SEE and UPVOTE","https://www.reddit.com/r/wallstreetbets/comments/lfwyg8/gme_13d_filing_please_see_and_upvote/"
1612853830,"Grand_Barnacle_6922","GME 13D filing by Fidelity","https://www.reddit.com/r/wallstreetbets/comments/lfwun3/gme_13d_filing_by_fidelity/"
1612853585,"Professional-Rice375","I’m using calls for AMC and GME but I’m noticing that calls are insanely high in IV throughout the weeks and months. If a squeeze does happen, will IV crush occurs? Thank you","https://i.redd.it/tubugc79geg61.jpg"
1612853569,"appleman33145","How to make life hard for short sellers of GME","https://www.reddit.com/r/wallstreetbets/comments/lfwsjj/how_to_make_life_hard_for_short_sellers_of_gme/"
1612853356,"Futureleak","GME go BRRRRRRRRRRR","https://i.redd.it/s112oshkfeg61.png"
1612853101,"Teraskikkeli","GME we like this stock","https://i.redd.it/drl7glfteeg61.jpg"
1612853009,"appleman33145","GME -Enhanced strategy- BUY. HOLD. CALL FOR A PROXY VOTE.","https://www.reddit.com/r/wallstreetbets/comments/lfwns6/gme_enhanced_strategy_buy_hold_call_for_a_proxy/"
1612852834,"1gnik","Why is this not mentioned at all in WSB??? GME shows being sold for 232-271 today on Fidelity active trader pro","https://i.redd.it/78clurt0eeg61.jpg"
1612852760,"Onboarding92","Pre-Ordering a Yacht cause GME about to be SQUOZED 🦍🦍 🚀 🚀","https://www.reddit.com/r/wallstreetbets/comments/lfh0r2/preordering_a_yacht_cause_gme_about_to_be_squozed/?utm_source=ifttt"
1612852577,"MangoDan","PSA to GME bagholders...","https://www.reddit.com/gallery/lfwk3d"
1612852338,"GlitchClick","$GME - Can anybody explain why I keep seeing this happen in Webull at night, it’s only ever this empty on GME 💎🤲🚀","https://www.reddit.com/gallery/lfwhzd"
1612852260,"Jokojima","Hold GME its for humanity!!!","https://www.reddit.com/r/wallstreetbets/comments/lfwh9u/hold_gme_its_for_humanity/"
1612851472,"muttonchoppers666","Somebody posted a video of someone driving a tank they allegedly bought with GME money while being chased by a cop last week and now I can’t find it","https://www.reddit.com/r/wallstreetbets/comments/lfwafo/somebody_posted_a_video_of_someone_driving_a_tank/"
1612851431,"mangchi12","WHAT IS THE PLAN GOR GME AMC TOMORROW? HOLD IS THE WORD! NO NEED TO TALK ABOUT WHEN! THIS IS NOT JUST PROFIT,","https://www.reddit.com/r/wallstreetbets/comments/lfwa25/what_is_the_plan_gor_gme_amc_tomorrow_hold_is_the/"
1612850774,"dedpossum","I'm a retard so why is GME still so high?","https://www.reddit.com/r/wallstreetbets/comments/lfw48f/im_a_retard_so_why_is_gme_still_so_high/"
1612850368,"XSh4d0W","GME DD: Float deep dive + MOASS speculations - Part 2","https://www.reddit.com/r/wallstreetbets/comments/lfw0ch/gme_dd_float_deep_dive_moass_speculations_part_2/"
1612850128,"Longjumping-Clue1814","True GME Holders.","https://www.reddit.com/r/wallstreetbets/comments/lfvy7u/true_gme_holders/"
1612849884,"Turdfurg23","GME math breakdown by Dookie Dimez. Stock price correlates with Reporting Dates &amp; Closing Positions","https://i.redd.it/ot1pxut85eg61.jpg"
1612849805,"oledayhda","How many get paid to spread sell &amp; against GME do I got to decline?","https://www.reddit.com/r/wallstreetbets/comments/lfvva7/how_many_get_paid_to_spread_sell_against_gme_do_i/"
1612849576,"sgj5788","How I felt with my 50 GME talking back to my boss when the price peaked at $483","https://v.redd.it/lp6e7nzm3eg61"
1612848249,"Solid-Concert-7165","Has anyone taken a short position on GME after it blew up?","https://www.reddit.com/r/wallstreetbets/comments/lfvgwh/has_anyone_taken_a_short_position_on_gme_after_it/"
1612848232,"ldog50","The Short Interest Report for GME will not be accurate","https://www.reddit.com/r/GME/comments/lfqqiz/fintel_short_data_altered_for_gme_amc/?utm_source=share&amp;utm_medium=web2x&amp;context=3"
1612848116,"Bomjus1","If my 1 share of GME doesn't go to the Moon, so help me God...","https://i.redd.it/ms18tkltzdg61.png"
1612848031,"Bomjus1","If my 1 share of GME doesn't go to the moon, so help me God...","https://imgur.com/a/MVfstb0"
1612847835,"camarock","Saw Mark Cuban at the GME tonight","https://streamable.com/fnwyom"
1612847811,"wolfylegend168","ORGANIC GME","https://i.redd.it/4ytxxi03zdg61.jpg"
1612847809,"Dumptruk31","SuperBowl LV and GME","https://www.reddit.com/r/wallstreetbets/comments/lfvcp0/superbowl_lv_and_gme/"
1612847524,"montana723","GME","https://www.reddit.com/r/wallstreetbets/comments/lfva0j/gme/"
1612847374,"camarock","Saw Mark Cuban at the GME tonight","https://v.redd.it/i0msm02rxdg61"
1612847177,"RaiseYourLenny","Can we just have a GME BB AMC megathread","https://www.reddit.com/r/wallstreetbets/comments/lfv6li/can_we_just_have_a_gme_bb_amc_megathread/"
1612846500,"Alsttr","Mods please stop deleting this meme I made for the sub: GME investors make hedge fund babies cry","https://youtu.be/JwZwC3s2xis?t=3s"
1612846473,"rubby589","I BELIEVE!! Holding till the end!! GME 🚀🧨","https://i.redd.it/mqpt0h04vdg61.jpg"
1612846461,"macksdhart","Not as cool as the moving rocket build but here’s my go at a GME meme 🚀 stock ticker 💎","https://i.redd.it/yhmaoam2vdg61.jpg"
1612845954,"R34vspec","Doing my part to boost GME Q1 earnings. These are going to Miller’s children’s hospital in Long Beach. $1800 worth Purchased with GME gains.","https://i.redd.it/5otbcv5ktdg61.jpg"
1612845885,"Magoo1522","Holding my GME still!!!","https://www.reddit.com/r/wallstreetbets/comments/lfutp5/holding_my_gme_still/"
1612845269,"Chasing_Billions","Why nobody talking about GME hits 293$ in after hours today?? Fellow ape needs some explanations here","https://i.redd.it/vlb88wjirdg61.jpg"
1612845205,"OkOil576","What’s the new AMC &amp; GME","https://www.reddit.com/r/wallstreetbets/comments/lfun1h/whats_the_new_amc_gme/"
1612844230,"No-Incident-8855","GME Part II","https://www.reddit.com/r/wallstreetbets/comments/lfud7l/gme_part_ii/"
1612843801,"steveferg","Holding GME","https://i.redd.it/zwv1anv5ndg61.jpg"
1612843789,"McReynolds611","Let’s Make AMC the next GME","https://www.reddit.com/r/wallstreetbets/comments/lfu8q9/lets_make_amc_the_next_gme/"
1612843788,"Benatako","GME and Synthetic Longs, Retards gotta explore all options","https://youtu.be/zbivjqpJGLo"
1612843747,"SnooSketches5287","Bb, AMC and GME Market manipulation, all of them went up after hours and then back down","https://i.redd.it/0undf280ndg61.jpg"
1612843718,"dudewithpie1","Win-win for GME bulls","https://www.reddit.com/r/wallstreetbets/comments/lfu807/winwin_for_gme_bulls/"
1612843691,"activeweekly","Repost From R/GME: FINTEL Short Data Altered for GME &amp; AMC","https://www.reddit.com/r/wallstreetbets/comments/lfu7q1/repost_from_rgme_fintel_short_data_altered_for/"
1612843593,"barackhusseinobama10","Huge GME gains!","https://i.redd.it/xd6wm2ojmdg61.jpg"
1612843507,"mickycupid","GME VS AMC Short Interest (Ortex) - Stock Price Correlates But Not Short Interest","https://www.reddit.com/r/wallstreetbets/comments/lfu5th/gme_vs_amc_short_interest_ortex_stock_price/"
1612843384,"Spintronics-GMF","GME - An argument for nostalgic value","https://www.reddit.com/r/wallstreetbets/comments/lfu4iq/gme_an_argument_for_nostalgic_value/"
1612843259,"mickycupid","GME VS AMC Short Interest (Ortex) - Stock Price Correlates But Not Short Interest","https://www.reddit.com/r/wallstreetbets/comments/lfu32t/gme_vs_amc_short_interest_ortex_stock_price/"
1612843215,"2020mikedean","Wall Street Bets Or GME Bets","https://www.reddit.com/r/wallstreetbets/comments/lfu2io/wall_street_bets_or_gme_bets/"
1612843170,"mickycupid","GME VS AMC Short Interest (Ortex) - Stock Price Correlates But Not Short Interest","https://www.reddit.com/r/wallstreetbets/comments/lfu20q/gme_vs_amc_short_interest_ortex_stock_price/"
1612843105,"myviewers","KOSS and GME analysis","https://www.reddit.com/r/wallstreetbets/comments/lfu1dy/koss_and_gme_analysis/"
1612843088,"mickycupid","GME VS AMC Short Interest (Ortex) - Stock Price Correlates But Not Short Interest","https://www.reddit.com/r/wallstreetbets/comments/lfu17z/gme_vs_amc_short_interest_ortex_stock_price/"
1612842956,"dontbedumbbro","GME and AMC is all over reddit 😂😂😂","https://i.redd.it/mhyppcbnkdg61.png"
1612842769,"myviewers","KOSS GME counting on","https://www.reddit.com/r/wallstreetbets/comments/lftxrl/koss_gme_counting_on/"
1612842727,"Dry_Yesterday7266","Can someone give me a serious input on GME","https://www.reddit.com/r/wallstreetbets/comments/lftxc2/can_someone_give_me_a_serious_input_on_gme/"
1612842507,"frank_knots","How accurate are Googles GME charts?","https://www.reddit.com/r/wallstreetbets/comments/lftuyu/how_accurate_are_googles_gme_charts/"
1612842439,"No-Incident-8855","GME Part II","https://www.reddit.com/r/wallstreetbets/comments/lftu8u/gme_part_ii/"
1612842279,"Professional_Home899","AMC / GME Very Interesting","https://i.redd.it/bzq6qfxmidg61.jpg"
1612842215,"supermanders","We had a GME high of $293 today?! (02/08 Mon) Can check NASDAQ","https://i.redd.it/qkbmmxqfidg61.jpg"
1612842214,"Sea-Serve-8054","Whats the move for tomorrow —- It seems like the GME is dead...time to jump on another stock???","https://www.reddit.com/r/wallstreetbets/comments/lftrw7/whats_the_move_for_tomorrow_it_seems_like_the_gme/"
1612841952,"Onboarding92","GME in a nutshell MEME","https://www.reddit.com/r/wallstreetbets/comments/lfkrdw/gme_in_a_nutshell_meme/?utm_source=ifttt"
1612841695,"Dress_Time","GME ?! ARE GME STOCKS INCREASING TOMORROW?","https://www.reddit.com/r/wallstreetbets/comments/lftmgw/gme_are_gme_stocks_increasing_tomorrow/"
1612841673,"Positive-Pen2923","GME short interest VS price analysis","https://www.reddit.com/r/wallstreetbets/comments/lftm8t/gme_short_interest_vs_price_analysis/"
1612841580,"Tlux0","Got 20 shares of GME and my tendies all ready for tomorrow","https://i.redd.it/5zcn5jqjgdg61.jpg"
1612841349,"giuliano1990","Found this info on GME stock price today FEBRUARY 8 (several ppll have confirmed)","https://www.reddit.com/r/wallstreetbets/comments/lftit4/found_this_info_on_gme_stock_price_today_february/"
1612841315,"gilly2004","So what's happened with GME has the price gone down again and stuff?","https://www.reddit.com/r/wallstreetbets/comments/lftift/so_whats_happened_with_gme_has_the_price_gone/"
1612841312,"terp_studios","It’s like Reddit Ads know I’m holding GME and AMC lmao.","https://i.redd.it/60ey3nfqfdg61.jpg"
1612841090,"Mumchug","GME ?...... Dcoin 30% in a week","https://www.reddit.com/r/wallstreetbets/comments/lftg7n/gme_dcoin_30_in_a_week/"
1612840917,"IlikeYuengling","GME Holders choking","https://www.reddit.com/r/dontbestupid/comments/lfns8a/dont_be_stupid_shoving_a_banana_down_your_throat/?utm_source=share&amp;utm_medium=web2x&amp;context=3"
1612840898,"sweetsweettendies","Sticking 25K into CLOV tomorrow. Because shorts came after Chamath Palihapitiya because of his GME short","https://www.reddit.com/r/wallstreetbets/comments/lfte99/sticking_25k_into_clov_tomorrow_because_shorts/"
1612840890,"Freugers","GME AMC ??!","https://www.reddit.com/r/wallstreetbets/comments/lfte6g/gme_amc/"
1612840759,"Freugers","GME AMC","https://www.reddit.com/r/wallstreetbets/comments/lftcuc/gme_amc/"
1612840606,"Scottieg99","When is short GME announcement?","https://www.reddit.com/r/wallstreetbets/comments/lftb8z/when_is_short_gme_announcement/"
1612840517,"Leading_Pattern831","GME and AMC OVER!","https://www.reddit.com/r/wallstreetbets/comments/lftabg/gme_and_amc_over/"
1612840497,"PatrickZhaoNA","Johnny Sins on GME","https://v.redd.it/e3d0d78qcdg61"
1612840355,"flintj76","GME is down, but man I wish I poured more money into lonely CTRM!!","https://i.redd.it/no3gk5zwcdg61.jpg"
1612840284,"Just_aGemini","GME commission for a friend","https://i.redd.it/syqjtm5pcdg61.jpg"
1612839922,"ibsa_","Can someone please explain this GME stat?","https://i.redd.it/gxolw5lmbdg61.jpg"
1612839651,"qadeer25","50% Short Interest for GME according to S3 LLC update from 3 days ago, squeeze really ain’t squoze if they’re lying about shorts clearing out. I STILL LIKE THE STOCK","https://i.redd.it/gmqmh6ntadg61.jpg"
1612839479,"merdock_69","My theory on GME","https://www.reddit.com/r/wallstreetbets/comments/lfsyoc/my_theory_on_gme/"
1612839477,"frank_knots","Google is showing inaccurate numbers on first GME push","https://www.reddit.com/r/wallstreetbets/comments/lfsynf/google_is_showing_inaccurate_numbers_on_first_gme/"
1612839356,"Thick_Duty_4777","Why GME and AMC","https://www.reddit.com/r/wallstreetbets/comments/lfsxdl/why_gme_and_amc/"
1612839348,"Tidy400","Make GME rocketing an annual event.","https://www.reddit.com/r/wallstreetbets/comments/lfsxax/make_gme_rocketing_an_annual_event/"
1612839198,"Black-Irish-Bastard","Damn, Simpsons even predicted GME","https://i.redd.it/elws24ab9dg61.gif"
1612839159,"whitetrash08","AMC GME","https://www.reddit.com/r/wallstreetbets/comments/lfsv65/amc_gme/"
1612839138,"ToonWorld13","Serious question about GME short data report tomorrow","https://www.reddit.com/r/wallstreetbets/comments/lfsuxd/serious_question_about_gme_short_data_report/"
1612838951,"JamonRuffles17","Elon, get GME to $1,000 and I will buy a TESLA with profits","https://www.reddit.com/r/wallstreetbets/comments/lfssrr/elon_get_gme_to_1000_and_i_will_buy_a_tesla_with/"
1612838837,"Local_Canary_8537","I bought 600 shares of GME @73$ last week. I lost $7K. Will the price go up or should I sell at loss👎👎👎","https://www.reddit.com/r/wallstreetbets/comments/lfsrh7/i_bought_600_shares_of_gme_73_last_week_i_lost_7k/"
1612838442,"Koipium","GME 🦍 walking down Wall Street on their 💎💎 like 🚀🚀🚀","https://i.redd.it/98nill277dg61.gif"
1612838436,"XRacistPandaX","Is it too late to join the GME drop?","https://www.reddit.com/r/wallstreetbets/comments/lfsn5t/is_it_too_late_to_join_the_gme_drop/"
1612838381,"Onboarding92","My best GME gain porn. $1,295 --&gt; $959,663 in just over 3 weeks. Sold because of brokers blocking buy orders. Sorry","https://www.reddit.com/r/wallstreetbets/comments/lfm36e/my_best_gme_gain_porn_1295_959663_in_just_over_3/?utm_source=ifttt"
1612838343,"Koipium","GME 🦍 walking down on their 💎💎 Wall Street like 🚀🚀🚀","https://i.redd.it/tj2wayaw6dg61.gif"
1612838095,"VelvetPancakes","Feb. 9 GME Short Interest Estimates","https://www.reddit.com/r/wallstreetbets/comments/lfsjf0/feb_9_gme_short_interest_estimates/"
1612837930,"ClimbaRoc","The NASDAQ website shows GME today’s high $293??? Amc says $16.50.. I don’t think this is a glitch 🚀🚀🚀","https://www.reddit.com/gallery/lfshoi"
1612837668,"Living-Twist1361","I got bored watching AMC and GME slowly tick down","https://www.reddit.com/r/wallstreetbets/comments/lfseu4/i_got_bored_watching_amc_and_gme_slowly_tick_down/"
1612837584,"Jesus_Murphy_knows","For those that believe the GME squeeze is over. Is there anything in the FINRA report that will get you back on the GME train?","https://www.reddit.com/r/wallstreetbets/comments/lfsdvk/for_those_that_believe_the_gme_squeeze_is_over_is/"
1612836967,"andresb46","Short Info GME","https://i.redd.it/qebijs7u2dg61.png"
1612836957,"camarock","Saw Mark Cuban tonight at the GME","https://imgur.com/gallery/86tONRN"
1612836934,"CompanySwag","PLS READ IF YOU HAVE GME","https://www.reddit.com/r/wallstreetbets/comments/lfs6lg/pls_read_if_you_have_gme/"
1612836897,"StarrTrader","The Truth about GME","https://www.reddit.com/r/wallstreetbets/comments/lfs67t/the_truth_about_gme/"
1612836750,"Pls9887","Please watch. It's about AMC, but GME will be the same deal. Guarantee it.","https://www.youtube.com/watch?v=1SbyBuzoxeI&amp;ab_channel=Trey%27sTrades"
1612836683,"mathazar","Suggestion to all GME 💎🤲, come join us in r/GME and r/WSBGAMESTOP. Give WSB a little breathing room.","https://www.reddit.com/r/wallstreetbets/comments/lfs3ro/suggestion_to_all_gme_come_join_us_in_rgme_and/"
1612836402,"CompanySwag","GME and HEDGEEZ PLS READ","https://www.reddit.com/r/wallstreetbets/comments/lfs0k0/gme_and_hedgeez_pls_read/"
1612836395,"rambat1994","Sen. Pat Toomey got 🧻👐 with GME","https://i.redd.it/54wtzskd0dg61.png"
1612836309,"11928374655647382911","FMR LLC (Fidelity) just acquired GME shares?","https://www.sec.gov/cgi-bin/browse-edgar?CIK=1326380&amp;owner=exclude"
1612836126,"aeloine","Lost $20k on GME, back at it with the gain porn (still holding some GME FYI)","https://i.redd.it/i1ipjpcc0dg61.jpg"
1612836032,"glen9999","$364K gain in 1 month. Mostly from GME shares.","https://i.redd.it/n785b7920dg61.jpg"
1612835882,"mathazar","Suggestion to all GME 💎🤲, come join us in r/GME and r/WSBGAMESTOP. Give WSB a little breathing room.","https://www.reddit.com/r/wallstreetbets/comments/lfruf5/suggestion_to_all_gme_come_join_us_in_rgme_and/"
1612835809,"yourboimun","New to investing and want to know what to invest in and how to find these crazy booms of stock prices like GME and AMC. Also how to find booming stocks yourself or any advice at all.","https://www.reddit.com/r/wallstreetbets/comments/lfrtlz/new_to_investing_and_want_to_know_what_to_invest/"
1612835455,"Ill-Piccolo-5286","GME = new world currency","https://www.reddit.com/r/wallstreetbets/comments/lfrppo/gme_new_world_currency/"
1612835205,"targus_targus","How I feel my first week of trading stonks and 💎✋ a fractional of GME i bought on RH","https://i.redd.it/or3dlowwwcg61.gif"
1612835108,"Owl_Euphoric","Haven’t given up on GME just got a side bet to keep me afloat","https://i.redd.it/n9hti85bxcg61.jpg"
1612834837,"bEAc0n","OMG WE HAVE THEM BY THE BALLS!!!!Tuesday, Feb. 9: Naked short interest report says GME @ 167% &amp; AMC @ 93% 🚀🚀🚀🚀 KEEP BUYING WE’RE GOING TO THE MOON 🚀🚀🚀🚀","https://www.reddit.com/r/wallstreetbets/comments/lfrizq/omg_we_have_them_by_the_ballstuesday_feb_9_naked/"
1612834664,"AlternativeFalcon721","GME ON LIFE SUPPORT","https://www.reddit.com/r/wallstreetbets/comments/lfrh2x/gme_on_life_support/"
1612834512,"BLAKEEMM","Papa Cohen and GME","https://www.reddit.com/r/wallstreetbets/comments/lfrfet/papa_cohen_and_gme/"
1612834508,"Whys_it_always_Dave","Who in their God-given candle munching right mind buys GME shares over 200% higher than asking price?","https://i.redd.it/qevl41qivcg61.png"
1612834461,"ITpythonIT","Noob here. Just wondering about the order book on GME after hours.","https://www.reddit.com/r/wallstreetbets/comments/lfret2/noob_here_just_wondering_about_the_order_book_on/"
1612834316,"flyguyfry96","IvY LeAgUe friends vs. 20 GME @ $320","https://i.redd.it/xqota6kyucg61.jpg"
1612833939,"UmamiPrusik86","WSB launching GME to the moon today","https://i.redd.it/qm7jw86utcg61.gif"
1612833845,"butterball223","GME to at least $150?","https://www.reddit.com/r/wallstreetbets/comments/lfr7zs/gme_to_at_least_150/"
1612833761,"aka5h","ORTEX estimated short interest GME","https://www.reddit.com/r/wallstreetbets/comments/lfr71n/ortex_estimated_short_interest_gme/"
1612833617,"Routine_Resort3350","A good sign! The Buccaneers won the Super Bowl. What’s that have to do with all of us GME share holders? Check it out.","https://www.reddit.com/gallery/lfr59n"
1612833228,"nycanon1","GME Fundamental Value","https://seekingalpha.com/article/4402732-examining-fundamental-value-of-gamestop"
1612833220,"sippyboots","When people ask me what I’m going to do with my GME shares","https://i.redd.it/2nit1j5prcg61.jpg"
1612833157,"YourOldPalHoward","Just a little Monday Motivation for all the GME Bagholders!","https://i.redd.it/13qqtnydrcg61.jpg"
1612832658,"KhAiMeLioN","My GME keychain arrived just in time for liftoff.","https://i.redd.it/9gd6yus0qcg61.jpg"
1612832565,"ambi7ion","I heard GME gains are okay to post again","https://www.reddit.com/gallery/lfqtj0"
1612832560,"KhAiMeLioN","This arrived just in time for GME liftoff","https://www.reddit.com/gallery/lfqtgl"
1612832515,"SkoshX","Can someone explain why some people are still saying GME didn't have a short squeeze yet?","https://www.reddit.com/r/wallstreetbets/comments/lfqswq/can_someone_explain_why_some_people_are_still/"
1612832487,"TheBaconDeeler","Thought I'd post some loss pron😩 GME to the moon I guess 🚀🚀","https://i.redd.it/scwpaqqipcg61.png"
1612832470,"KhAiMeLioN","Arrived just in time for GME Liftoff!!","https://www.reddit.com/gallery/lfqsc7"
1612832456,"Responsible-One4949","I don’t know shit about stocks but have invested a couple grand into some very recently. My question is when is GME gonna rise up again?","https://www.reddit.com/r/wallstreetbets/comments/lfqs5e/i_dont_know_shit_about_stocks_but_have_invested_a/"
1612832410,"moses_vs_jesus","Me after holding on to my single share of GME I bought at $360.","https://i.redd.it/duy6fjl1pcg61.jpg"
1612832371,"PaybacksAreABeotch","Glenn Beck weighs in on GameStop And even if you disagree with some of his politics you got hear what he says about the GME WSB saga","https://www.reddit.com/r/wallstreetbets/comments/lfqqzn/glenn_beck_weighs_in_on_gamestop_and_even_if_you/"
1612832307,"M4PPP","GME PRE MARKET 🚀🚀🚀🦍🦍🦍","https://i.redd.it/sp40r53yocg61.jpg"
1612832296,"M4PPP","GME PRE MARKET 🚀🚀🚀🦍🦍🦍","https://i.redd.it/hwy7osvvocg61.jpg"
1612832140,"alexs1mmo","Is Melvin serious? GME chart analysis","https://i.imgur.com/FTph8Xu.jpg"
1612832073,"ambi7ion","I heard GME gains are safe to post again","https://www.reddit.com/r/wallstreetbets/comments/lfqnnc/i_heard_gme_gains_are_safe_to_post_again/"
1612831201,"The-Bodhii","I was browsing GME comments on Webull. People are saying that orders were being filled above $300 on GME order books. Here are some screenshots from there. Can anyone verify this?","https://www.reddit.com/gallery/lfqdkj"
1612831157,"R34vspec","Infinite GME hack","https://www.reddit.com/r/wallstreetbets/comments/lfqd3c/infinite_gme_hack/"
1612831076,"Accomplished_Pay_987","Can we do Apple like GME ?","https://www.reddit.com/r/wallstreetbets/comments/lfqc8q/can_we_do_apple_like_gme/"
1612830984,"No-Fish361","is everything but GME posts getting deleted? we get it, hold. also there are other things to buy....","https://www.reddit.com/r/wallstreetbets/comments/lfqb7z/is_everything_but_gme_posts_getting_deleted_we/"
1612830978,"The-Bodhii","I was browsing the Webull comment section for GME and people are saying that orders were filled for GME me at over $300 in the order books. Can anyone verify??","https://i.redd.it/9f1w5c71lcg61.jpg"
1612830776,"HotspurN17","My understanding on the current GME situation","https://www.reddit.com/r/wallstreetbets/comments/lfq8uc/my_understanding_on_the_current_gme_situation/"
1612830753,"jonhmarks","GME - Investor's Dilemma (Game Theory/Nash Equilibrium)","https://i.redd.it/k4byyv4dkcg61.jpg"
1612830748,"Creampiethigh","MUST READ FOR AMC/ GME FOLKS!!! PATIENCE IS THE KEY TO SUCCESS","https://www.reddit.com/r/wallstreetbets/comments/lfq8j5/must_read_for_amc_gme_folks_patience_is_the_key/"
1612830694,"justanothercommylovr","GME in a nutshell. But I'm still holding. 🚀","https://giphy.com/gifs/memecandy-XGs9bC2r3fvWtYUWHj"
1612830667,"Lber127","GME","https://www.reddit.com/r/wallstreetbets/comments/lfq7l0/gme/"
1612830590,"Tucker-French","GME has slowed to a crawling halt after hours. Look at the delay in orders.","https://i.redd.it/fwp7oqyojcg61.jpg"
1612830480,"Helpful-Hippo-7227","Hey Guys, why you think GME is not squeezing from 40 usd to 400 usd? (I am not investing but I think the squeeze is already done)","https://i.redd.it/jeqy1tyjjcg61.jpg"
1612830382,"Theintelligencegap","GME should turn itself into a SPAC","https://www.reddit.com/r/wallstreetbets/comments/lfq4e4/gme_should_turn_itself_into_a_spac/"
1612830301,"Mconzudig","GME","https://www.reddit.com/r/wallstreetbets/comments/lfq3hp/gme/"
1612830246,"Qpwna_Lie","When are at gonna push GME again?","https://www.reddit.com/r/wallstreetbets/comments/lfq2vq/when_are_at_gonna_push_gme_again/"
