"created_utc","author","title","url"
1612984165,"oldtownmaine","Ameritrade won’t let me put in a good til cancel limit order to sell GME at $775 because it’s “significantly higher than the last traded price.” Fine .. I won’t sell it at all then.","https://i.redd.it/ij65jdfj8pg61.jpg"
1612984128,"Greengobrrr","Where's the GME coverage?","https://www.reddit.com/r/wallstreetbets/comments/lh13oi/wheres_the_gme_coverage/"
1612983995,"pleasant_equation","Got greedy at the peak of GME and even started picking out houses I’d be able to buy when it got to 5k - I’ve now sold","https://i.redd.it/d8q1m5518pg61.jpg"
1612983965,"gmr2000","Reddit made more money on GME than wsb","https://www.reuters.com/article/us-reddit-funding-idUSKBN2A9056"
1612983803,"FTP1199","Look at GME chart on LOG scale","https://www.reddit.com/r/wallstreetbets/comments/lh0z5o/look_at_gme_chart_on_log_scale/"
1612983800,"winstinx","Fidelity Bros have gone from 13% IG GME to 87 shares.","https://i.redd.it/kq9kquag7pg61.jpg"
1612983781,"Bendabrute","FMR dumped their entire GME stake on 1/29","https://www.reddit.com/r/wallstreetbets/comments/lh0yts/fmr_dumped_their_entire_gme_stake_on_129/"
1612983608,"Gracchus79","From France. GME TO THE MOON !! 🚀🌙","https://i.redd.it/4q0li1sv6pg61.jpg"
1612983570,"MarqueeOfStars","More than GME and I love it","https://www.reddit.com/r/wallstreetbets/comments/lh0voa/more_than_gme_and_i_love_it/"
1612983348,"whyrweyelling","Some loss porn, I'm actually only down 2.8K overall, the last drop was my account migrating to Fidelity I traded my slow movers for GME at 123 with 27 shares. I also traded BB, got in at 17.38 at 120 shares. Still HOlding :diamond-hands: I'm down about 60% so far overall.","https://i.redd.it/99p0m17v5pg61.jpg"
1612983212,"Whatintheworld0000","GME bottom? Is the 50 SMA our current local bottom?","https://i.redd.it/kwjg5fap5pg61.jpg"
1612983187,"WhiskeyMonkey408","DeFi? GME","https://apple.news/ADzTrN_MtRkOerCFjgcTJBg"
1612983130,"MyNameIsYeffff","Right when Fidelity sold 3 billion worth of GME it tanked. What a finesse 😂 😭","https://www.reddit.com/gallery/lh0pl4"
1612983126,"strider2694","GME Analyst Data","https://www.reddit.com/r/wallstreetbets/comments/lh0pjs/gme_analyst_data/"
1612983064,"AeLyXr","Some DD to consider for GME","https://www.reddit.com/r/wallstreetbets/comments/lh0omb/some_dd_to_consider_for_gme/"
1612982894,"[deleted]","Fidelity cashed out as GME biggest stake holder at peak. There goes your ladder attack nonsense and that's why they were letting users buy unrestricted. 9M shares suddenly on the market.","https://www.wsj.com/amp/articles/fidelity-cashes-in-most-of-gamestop-stake-11612980430"
1612982822,"TheMegot55","Robinhood Sells my GME holding without my Consent...","https://www.reddit.com/r/wallstreetbets/comments/lh0l7z/robinhood_sells_my_gme_holding_without_my_consent/"
1612982776,"bennythabeaver","Fuck WSB, GME going up bb","https://www.reddit.com/r/wallstreetbets/comments/lh0kk8/fuck_wsb_gme_going_up_bb/"
1612982727,"[deleted]","Fidelity cashed out as GME biggest stake holder at peak. There goes your ladder attack nonsense and that's why they were letting users buy unrestricted. 9M shares suddenly on the market.","https://www.google.com/amp/s/www.wsj.com/amp/articles/fidelity-cashes-in-most-of-gamestop-stake-11612980430"
1612982639,"anon-mana","“Bearish” Pattern Detected on GME 🛸🚀🛸","https://i.redd.it/shjezdyz3pg61.jpg"
1612982627,"Leonardsleim","Switching sides on GME and AMC 🗿🗿🗿","https://i.redd.it/v1qjub2y3pg61.jpg"
1612982566,"Cynical_Prince","When diamond hands sees GME go green","https://i.redd.it/c0k4mnyo3pg61.gif"
1612982559,"cdudek89","Buying back into GME be like","https://i.redd.it/o3pqyvhr3pg61.jpg"
1612982481,"[deleted]","GME YOLO update — Feb 10 2021","https://i.redd.it/gu8wew4j3pg61.jpg"
1612982457,"[deleted]","GME YOLO update — Feb 10 2021","https://i.redd.it/g9mm30hg3pg61.jpg"
1612982437,"Unique_Fly_586","GME","https://www.reddit.com/r/wallstreetbets/comments/lh0fr9/gme/"
1612982393,"[deleted]","GME YOLO update — Feb 10 2021","https://i.redd.it/1qk5d5o93pg61.jpg"
1612982345,"Cynical_Prince","When diamond hands sees GME go green","https://i.imgur.com/kRFPzKE.gif"
1612982340,"JustGimmeDatMoney","Me after paperhanding GME at a loss and dumping everything into SNDL and APHA","https://www.youtube.com/watch?v=JNZmPOBsmCQ"
1612982332,"Individual-investor","GME to moon time starting","https://www.reddit.com/r/wallstreetbets/comments/lh0ebr/gme_to_moon_time_starting/"
1612982240,"1shiny_hobo","Got on the GME rocket. Lets fucking go!!!","https://i.redd.it/8fq56yfn2pg61.png"
1612982223,"strider2694","Analyst Price Targets on GME","https://www.reddit.com/r/wallstreetbets/comments/lh0cvl/analyst_price_targets_on_gme/"
1612982211,"[deleted]","1000 more shares of GME - Suck my fat tendie Melvin","https://i.redd.it/09n9j2zp2pg61.png"
1612982165,"pigguswiggus","I have an idea to help GME apes but I might be retarded. Recurring investments?","https://www.reddit.com/r/wallstreetbets/comments/lh0c22/i_have_an_idea_to_help_gme_apes_but_i_might_be/"
1612982104,"kschin1","GME IS SKYROCKETING AGAIN","https://www.reddit.com/r/wallstreetbets/comments/lh0b5q/gme_is_skyrocketing_again/"
1612982080,"[deleted]","So... GME was over this morning, huh?","https://i.redd.it/fy2iztsa2pg61.png"
1612982063,"1980sTokyo","It’s at $60 GME stop deleting this!!!","https://i.redd.it/f9xtpuda2pg61.jpg"
1612981991,"[deleted]","ITSREAL85's GME GTA vid","https://www.youtube.com/watch?v=Zl4rRFiSWf8"
1612981945,"JohDon_84_Rumble","SNDL = GME #2","https://www.reddit.com/r/wallstreetbets/comments/lh08w1/sndl_gme_2/"
1612981944,"MrSorge","Still Holding my 927 GME Shares","https://www.reddit.com/r/wallstreetbets/comments/lh08vt/still_holding_my_927_gme_shares/"
1612981846,"Appropriate-Bite7648","Whats up with GME today","https://www.reddit.com/r/wallstreetbets/comments/lh07k0/whats_up_with_gme_today/"
1612981810,"Sensitive_Disk5243","Dear GME today's upward trend","https://www.reddit.com/r/wallstreetbets/comments/lh071m/dear_gme_todays_upward_trend/"
1612981780,"Hydraclaw52","GME GME GME","https://www.reddit.com/r/wallstreetbets/comments/lh06m1/gme_gme_gme/"
1612981704,"Realistic_Work3799","GME","https://www.reddit.com/r/wallstreetbets/comments/lh05ke/gme/"
1612981694,"Roidnutrition","GME is rising 🚀🚀🚀","https://i.redd.it/5sr4bax61pg61.jpg"
1612981682,"uj-usa","GME another Squeeze???","https://www.reddit.com/r/wallstreetbets/comments/lh059d/gme_another_squeeze/"
1612981679,"xXxBig_PoppaxXx","I believe we’ve found our next GME level gains boys, SNDL TO THE MOON🚀🚀🚀🚀🚀🚀🚀🚀🚀🚀🚀🚀🚀🚀🚀🚀🙌🏻💎","https://i.redd.it/umv0pu951pg61.jpg"
1612981652,"[deleted]","GME Comeback in the works?","https://i.redd.it/uwe4c2c21pg61.jpg"
1612981562,"Helpdesk512","GME Spike is here get back in ASAP","https://www.reddit.com/r/wallstreetbets/comments/lh03k4/gme_spike_is_here_get_back_in_asap/"
1612981536,"Tony57-4139","GME short interest","https://www.reddit.com/r/wallstreetbets/comments/lh037j/gme_short_interest/"
1612981349,"GrowthGood","Madam GME coming...","https://youtu.be/7-pNsgL1zxE"
1612981336,"Outrageous_War9263","GME is up 9 dollars","https://www.reddit.com/r/wallstreetbets/comments/lh00bn/gme_is_up_9_dollars/"
1612981320,"NYb112","Good day for GME and AMC","https://www.reddit.com/r/wallstreetbets/comments/lh002x/good_day_for_gme_and_amc/"
1612981313,"[deleted]","GME shooting up.","https://i.redd.it/slvuzy120pg61.jpg"
1612981254,"Cerealmarshmallows","Anyone else have their Penny Stock / Micro Cap Boom with the GME AMC Short Squeeze What do you is happening?","https://www.reddit.com/r/wallstreetbets/comments/lgzz6t/anyone_else_have_their_penny_stock_micro_cap_boom/"
1612981182,"kylehouser","Fidelity liquidated GME -- Can't blame RH for everything","https://www.reddit.com/r/wallstreetbets/comments/lgzy5g/fidelity_liquidated_gme_cant_blame_rh_for/"
1612981116,"[deleted]","I'm shorting GME at 68$ am i doing it right ?","https://www.reddit.com/r/wallstreetbets/comments/lgzx8w/im_shorting_gme_at_68_am_i_doing_it_right/"
1612980981,"2yan","DD: GME Is going to go up, SNDL is going to go down. Here's how I can guarantee it.","https://www.reddit.com/r/wallstreetbets/comments/lgzvc9/dd_gme_is_going_to_go_up_sndl_is_going_to_go_down/"
1612980917,"olddudes","How Much is GME really worth ?","https://www.reddit.com/r/wallstreetbets/comments/lgzugm/how_much_is_gme_really_worth/"
1612980616,"[deleted]","GAMESTOP GME BREAKING NEWS! Institutions going to Congress 🏛","https://youtube.com/watch?v=u6yuaupKAmA&amp;feature=share"
1612980541,"keshowse","We on GME like","https://i.redd.it/2zfc1gpqxog61.jpg"
1612980437,"Bumblebeeintheair","GME AMC","https://www.reddit.com/r/wallstreetbets/comments/lgznld/gme_amc/"
1612980378,"eggguy","Is it happening??? GME &amp; AMC (&amp; other shorted stocks) up double digits and climbing","https://i.redd.it/k987c6u6xog61.jpg"
1612980303,"Askin55","GUYS GME IS NOT OVER WE GOT THEM GUYS","https://www.reddit.com/r/wallstreetbets/comments/lgzlm2/guys_gme_is_not_over_we_got_them_guys/"
1612980293,"Gold3n1","GME IS HAPPENING.","https://www.reddit.com/r/wallstreetbets/comments/lgzlh6/gme_is_happening/"
1612980265,"OliverDatlon","GME starting to walk again, to the FUCKING MOON 🚀🌕💎🙌","https://www.reddit.com/r/wallstreetbets/comments/lgzl27/gme_starting_to_walk_again_to_the_fucking_moon/"
1612980243,"Askin55","GME IS NOT DEAD GUYS WE GOT THEM GOGOGOGO","https://www.reddit.com/r/wallstreetbets/comments/lgzkpq/gme_is_not_dead_guys_we_got_them_gogogogo/"
1612980228,"zidane10211021","keep holding! AMC GME !!","https://www.reddit.com/r/wallstreetbets/comments/lgzki3/keep_holding_amc_gme/"
1612980204,"Askin55","GME JUST STARTET","https://www.reddit.com/r/wallstreetbets/comments/lgzk5g/gme_just_startet/"
1612980136,"PoorNoobTrader","GME to the moon!","https://www.reddit.com/r/wallstreetbets/comments/lgzj4g/gme_to_the_moon/"
1612980110,"[deleted]","I don't want to hotbox the room with too much hopium but the RSI not going below 40 on GME is traditionally known as a bullish sign! (DYOR)","https://i.redd.it/1xj9aulzvog61.png"
1612980009,"henry232333","Just wanna show this Retard has had some success..Cannabis and Space are the next dot com IMO..I’m not an adviser this isn’t advice just my opinion and strategy but other than another GME scenario this is how I see average Americans getting rich over next 1-5 years","https://www.reddit.com/gallery/lgzgyb"
1612979947,"gentrifydeeshoes","If you have margin on your account your shares may be held in margin and lent out even if you bought with cash! Remove margin for your GME shares so they cannot be lent.","https://i.redd.it/3swqztszvog61.jpg"
1612979946,"CasualRedditorNA","IF YOU CAN HOLD AMC AND GME THROUGH THE RED YOU BETTER HOLD THROUGH THE GREEN🦍💎","https://i.redd.it/nu4ptwtzvog61.jpg"
1612979867,"Warm-Razzmatazz5291","Why are GME Short Interest Reports Different?","https://www.reddit.com/r/wallstreetbets/comments/lgzf2e/why_are_gme_short_interest_reports_different/"
1612979824,"Zoo-Lander7","Every time GME goes slightly up","https://imgflip.com/i/4xi0qp"
1612979638,"BullyMcbullface","Robinhood survey about GME And AMC","https://www.reddit.com/r/wallstreetbets/comments/lgzc0b/robinhood_survey_about_gme_and_amc/"
1612979568,"eagleeyerattlesnake","Decided to make a watchlist based on what you retards were talking about a couple weeks ago. Went all in on GME and still holding!","https://i.redd.it/ezv7zs4iuog61.png"
1612979388,"BrilliantSchnapsidee","GME bag holders since sub-$100 prices (don’t worry, I’m one of them) 🚀🚀🚀🙌🏻💎🦍🦍","https://i.redd.it/csdhyoybuog61.jpg"
1612979323,"RustyPotatoes4u","Where is GME today?! 💎 🙌 🚀 🌙","https://i.redd.it/62c0gk35uog61.jpg"
1612978872,"DaFinLS","Should I buy GME shares now?","https://www.reddit.com/r/wallstreetbets/comments/lgz1by/should_i_buy_gme_shares_now/"
1612978692,"[deleted]","GME is still gonna go up boys! I did the math and we got a chance to squeeze the squeeze!","https://www.reddit.com/r/wallstreetbets/comments/lgyys6/gme_is_still_gonna_go_up_boys_i_did_the_math_and/"
1612978628,"MooseRides1369","GME Today","https://www.reddit.com/r/wallstreetbets/comments/lgyxuz/gme_today/"
1612978586,"307Salem","A GME strong holder from Hong Kong","https://www.reddit.com/r/wallstreetbets/comments/lgyx9b/a_gme_strong_holder_from_hong_kong/"
1612978523,"Snugglepuff82","GME","https://www.reddit.com/r/wallstreetbets/comments/lgywdm/gme/"
1612978252,"SpoonySam","Not the worst loss porn in the world but still sucks. Thanks GME","https://i.redd.it/r7s7tlfyqog61.jpg"
1612978039,"yippie_kiiyay","STOP FUCKING DELETING AMC AND GME POSTS YOU PSYOP FUCKS","https://www.reddit.com/r/wallstreetbets/comments/lgypki/stop_fucking_deleting_amc_and_gme_posts_you_psyop/"
1612977985,"jbougearel","What would happen if All Apes and Retards requested delivery of their GME stock certificates? Could the brokerages actually do it? Or would they just say “No.”","https://www.reddit.com/r/wallstreetbets/comments/lgyou2/what_would_happen_if_all_apes_and_retards/"
1612977982,"2sc","If everyone holds, would the price of GME ever drop enough for wall street to meet their shorts?","https://www.reddit.com/r/wallstreetbets/comments/lgyoss/if_everyone_holds_would_the_price_of_gme_ever/"
1612977896,"TadpoleCreative","GME PAINTED A TARGET ON US","https://www.reddit.com/r/wallstreetbets/comments/lgynnm/gme_painted_a_target_on_us/"
1612977750,"cr__ked","Thought on GME","https://www.reddit.com/r/wallstreetbets/comments/lgyljr/thought_on_gme/"
1612977743,"[deleted]","All my friends and family when I told them to buy GME when it was at $30","https://v.redd.it/a97hx38dpog61"
1612977622,"sirkilzlot","P.F. Chang’s knows. GME to the moon 🚀🚀🚀","https://i.redd.it/ga74xrp2pog61.jpg"
1612977598,"Purovagos","GME future!","https://www.reddit.com/r/wallstreetbets/comments/lgyjg9/gme_future/"
1612977478,"ColBre22","[GIF REQUEST] The ""witness him"" scene from Mad Max: Fury Road with relevant GME labels slapped onto characters","https://www.reddit.com/r/wallstreetbets/comments/lgyht8/gif_request_the_witness_him_scene_from_mad_max/"
1612977343,"Bli34d2","GME FLOAT?","https://www.reddit.com/r/wallstreetbets/comments/lgyfvn/gme_float/"
1612977310,"1_sorry_dog","5 day comparison of AMC + GME stock. The symmetri shows that it ain't humans but robots traiding stocks. Stay calm, squeeze hard and i'll see you on the moon!","https://i.redd.it/nxkd1uz4nog61.png"
1612977095,"J355ica1l","GME","https://www.reddit.com/r/wallstreetbets/comments/lgycff/gme/"
1612977093,"Blondon744","AMC and GME SI% MUST READ","https://www.reddit.com/r/wallstreetbets/comments/lgycej/amc_and_gme_si_must_read/"
1612977019,"hitchdiddy","As a machine learning enthusiast, I fitted a state of the art multivariate regression model in the GME chart and I was surprised by the result","https://www.reddit.com/r/wallstreetbets/comments/lgybcx/as_a_machine_learning_enthusiast_i_fitted_a_state/"
1612976977,"The-Infamous-D","GME SHORTS DATA FROM YAHOO!! ?? 🤯","https://www.reddit.com/r/wallstreetbets/comments/lgyar8/gme_shorts_data_from_yahoo/"
1612976837,"BloodOk3576","We hold GME 👍👍","https://i.redd.it/tiprc8lqmog61.jpg"
1612976808,"[deleted]","The GME squeeze","https://www.reddit.com/r/MakeMeSuffer/comments/lcql7e/just_this_toad_taking_a_dump/?utm_source=share&amp;utm_medium=ios_app&amp;utm_name=iossmf"
1612976790,"notimeforabra","$ell GME","https://www.reddit.com/r/wallstreetbets/comments/lgy82j/ell_gme/"
1612976419,"TheKidKnox","GME to WSB 💎👐🚀🌚 #diamondhands","https://i.redd.it/r6g14n4ilog61.jpg"
1612976418,"TheRealMK211","GME $60 gap will fill. 47 strong support","https://i.redd.it/g8bxx24ilog61.jpg"
1612976328,"ValueEvangelist","GME and AMC Borrow rates way down","https://www.reddit.com/r/wallstreetbets/comments/lgy14w/gme_and_amc_borrow_rates_way_down/"
1612976113,"TigerMatahari","Post GME","https://www.reddit.com/r/wallstreetbets/comments/lgxy6g/post_gme/"
1612976038,"lemonheadwinston","GME &amp; AMC Ownership Stats according to Factset","https://www.reddit.com/r/wallstreetbets/comments/lgxx62/gme_amc_ownership_stats_according_to_factset/"
1612976006,"[deleted]","Post GME","https://www.reddit.com/r/wallstreetbets/comments/lgxwro/post_gme/"
1612975873,"onepixelmaui","My 1st post on Reddit. I have no idea what I’m doing. But overall stock market is way down. GME is up!","https://www.reddit.com/r/wallstreetbets/comments/lgxuzf/my_1st_post_on_reddit_i_have_no_idea_what_im/"
1612975776,"k1ngxgeorge","GME","https://www.reddit.com/r/wallstreetbets/comments/lgxtk8/gme/"
1612975760,"blompersv2","GME bag holders be like","https://i.redd.it/umzg27wijog61.jpg"
1612975656,"[deleted]","Yolo on GME 🚀🚀🚀","https://i.redd.it/vzxnxuj8jog61.jpg"
1612975564,"Legionxzz","I know there are some retards here who are still holding GME and AMC and I'm so sad","https://www.reddit.com/r/wallstreetbets/comments/lgxql5/i_know_there_are_some_retards_here_who_are_still/"
1612975480,"emdizzle93881","GME and AMC are opening strong today may take off for those who are holding.","https://www.reddit.com/r/wallstreetbets/comments/lgxpiv/gme_and_amc_are_opening_strong_today_may_take_off/"
1612975404,"emdizzle93881","AMC and GME 🚀🚀🚀","https://www.reddit.com/r/wallstreetbets/comments/lgxojc/amc_and_gme/"
1612975065,"brewlee","Call on special approach for current state of GME affairs.","https://www.reddit.com/r/wallstreetbets/comments/lgxjwe/call_on_special_approach_for_current_state_of_gme/"
1612974889,"Desperate_Growth2269","Insert your do_ge coin into the sundial grower for your GME to grow lol","https://i.redd.it/vbpo4ndygog61.jpg"
1612974540,"Jellyfish_Vegetable","GME YOLO UPDATE","https://i.redd.it/uyzjjn2wfog61.jpg"
1612974405,"[deleted]","Just bought 20 more GME Shares in the sale, im not selling. 💎💎","https://i.redd.it/j075bncgfog61.png"
1612974185,"ToadhillOddities","GME Diamond hand Stonk rocket to the Mooooon! (OC I made these) I've been cheering for yall!","https://i.redd.it/dy9jleoueog61.jpg"
1612974143,"DramaAlertThrowAway","BOUNCED RIGHT OFF THE MARGIN MAINTENANCE LINE BOYS! WE IN THIS. HODL THE LINE for GME","https://i.redd.it/x8kbrsjqeog61.jpg"
1612974089,"Amazingdev2020","GME makes no sense","https://www.reddit.com/r/wallstreetbets/comments/lgx6wq/gme_makes_no_sense/"
1612973869,"enfiniti27","Fidelity has 407k shares of GME available to short now when none have been avail since June or before","https://i.redd.it/7hi9s15vdog61.png"
1612973837,"Meshalr9","So the mighty lion 🦁 of wallstreetbets turned out to be a pussy cat 🐈? They told you won and believed them? They told you they will make a movie and you get special? And as always you end up holding your 🐓 in your hands diamond 💎 bullshit hands 🙌 what a bunch of weak ass 🦍 s GME going strong","https://images.app.goo.gl/SkyFmZQpQuBvoQxPA"
1612973830,"gnarlyoldman","GME Squeeze? Shorts are down to 42%. Daily average volume is high % of total shares outstanding. Anyone who wants to cover shorts can easily do so. We need to pat ourselves on the back, and move on to a new squeeze play. This one is over.","https://i.redd.it/mnuovb6qcog61.jpg"
1612973801,"LordInvestor","Doubling down on GME ?","https://www.reddit.com/r/wallstreetbets/comments/lgx32o/doubling_down_on_gme/"
1612973273,"Hollywood_Star","MMNFF is the new GME","https://www.reddit.com/r/wallstreetbets/comments/lgwvsw/mmnff_is_the_new_gme/"
1612973176,"bejandianaandrei","80% loss on GME, broke student, but i am happy that the *big* boiz lost more because of me. Hold GME","https://www.reddit.com/r/wallstreetbets/comments/lgwugf/80_loss_on_gme_broke_student_but_i_am_happy_that/"
1612973054,"BhatEaNKO","Make Wirecard (WDI) blow like GME and people would make bank!! Imagine if you put €100 into it now and it regained its highest value, you would earn €42k return... Currently trading at €0.45... About a year ago it spiked up and quadrupled my investment and that was without any hype","https://www.reddit.com/r/wallstreetbets/comments/lgwsuz/make_wirecard_wdi_blow_like_gme_and_people_would/"
1612973047,"Ok_Lunatic","buy GME","https://www.reddit.com/r/wallstreetbets/comments/lgwsru/buy_gme/"
1612972726,"Bullet0770","I am holding 10K of GME &amp; AMC. I am thinking of buying calls now, what is the best option price for me. Should I go AMC or GME. New to these call options. 💎🙌💎🙌","https://www.reddit.com/r/wallstreetbets/comments/lgwobu/i_am_holding_10k_of_gme_amc_i_am_thinking_of/"
1612972716,"Jacksonxp1","I've been told short sellers benefit markets by adding liquidity. Does it make sense that GME % shares short to volume has been increasing steadily since end-Jan, while price has been trending down? Falling prices means an excess of sellers to buyers; why short more? To save their 45M shorts @$38?","https://i.redd.it/q95ffgufaog61.png"
1612972706,"Getshorts","GME - This man loves this stonk! He just invested 100.000 USD! 🚀🚀🚀🚀🚀🚀🚀 LET'S GO 🦧🐒🦍🦍🐒🦧! And buy the remaining ones! Every little helps! (no financial advise). And I will not sell cheap can we reach 69,384?","https://www.reddit.com/r/DeepFuckingValue/comments/lgwmry/gme_this_man_loves_this_stonk_he_just_invested/?utm_medium=android_app&amp;utm_source=share"
1612972591,"syednajeebuddin","GME - 02/10/2021","https://i.redd.it/0r2eum33aog61.jpg"
1612972458,"[deleted]","Where to find latest numbers on GME short%?","https://www.reddit.com/r/wallstreetbets/comments/lgwkvi/where_to_find_latest_numbers_on_gme_short/"
1612972267,"bishopbyday","I'm sure my 5 GME shares are going to lead me to FIRE. Soon.","https://www.reddit.com/r/wallstreetbets/comments/lgwiek/im_sure_my_5_gme_shares_are_going_to_lead_me_to/"
1612972259,"a_toaster_strudel","How many GME shares do we have? Maybe at least 4554","https://www.reddit.com/r/wallstreetbets/comments/lgwib0/how_many_gme_shares_do_we_have_maybe_at_least_4554/"
1612972225,"[deleted]","All these dubs have me hopeful for GME","https://i.redd.it/x4ngpu8y8og61.png"
1612972199,"1541drive","CNBC at it moving attention away from GME to TLRY","https://i.redd.it/aa9owo8u8og61.jpg"
1612972170,"brrpppp","THE Bank is legit showing me signals to buy GME @50 IF THIS ISNT A SIGN then I’m not sure buying 100 shares right now FUCK IT","https://i.redd.it/4s8iqmbu8og61.jpg"
1612972103,"razielll6","GME data from today - shouldn't the short data be updated yesterday ? love how there's more company than there is company... fkn epic","https://i.redd.it/ea1fv35i8og61.png"
1612972073,"Particular_Job_3174","RH, Citadel and Melvin execs expected to testify in congress!!! GME","https://i.redd.it/2h1w76yk8og61.jpg"
1612971565,"[deleted]","Buying AMC @ 18,50 = buying GME @300+? i dont loose the money if i dont sell it, right? 🚀🚀🚀🚀🚀🚀🚀","https://i.redd.it/ahkibkpw6og61.png"
1612971444,"fly6996","Trading platforms for GME in UK?","https://www.reddit.com/r/wallstreetbets/comments/lgw7na/trading_platforms_for_gme_in_uk/"
1612971396,"[deleted]","Buying AMC @ 18,50 = buying GME @300+? i dont loose the money if i dont sell it, right?","https://i.redd.it/cyio85r86og61.png"
1612971137,"badintroduction","Who cares about GME","https://www.reddit.com/r/wallstreetbets/comments/lgw3ts/who_cares_about_gme/"
1612971133,"ZappyZach","GME UNDER $50","https://i.redd.it/0o11kges5og61.jpg"
1612970887,"heising1911","Will my 15 GME stocks go up again? Im Confused...","https://www.reddit.com/r/wallstreetbets/comments/lgw0jl/will_my_15_gme_stocks_go_up_again_im_confused/"
1612970849,"jenkinsgj2","What's next after GME","https://www.reddit.com/r/wallstreetbets/comments/lgw027/whats_next_after_gme/"
1612970592,"mk3jett","If GME taught me anything, its buy high sell low! Then say YOLO! Being Retarded is expensive but i just love the pretty colors","https://i.redd.it/kc9s9nwz3og61.png"
1612970549,"JwolfMunster","GME Noice","https://www.reddit.com/r/wallstreetbets/comments/lgvw2x/gme_noice/"
1612970388,"S1KRR_19","GME Short updated - 78.46%","https://www.reddit.com/r/wallstreetbets/comments/lgvu0k/gme_short_updated_7846/"
1612970216,"[deleted]","GME is back!!! Big Yolo on weekly calls. Going to the moon 🚀🚀🚀","https://i.redd.it/qkf3mm613og61.jpg"
1612970185,"[deleted]","Me bidding my family and dog farewell before GME goes to pluto 🚀🚀","https://i.redd.it/l581996u2og61.gif"
1612970151,"LegitCoder1","Holding GME","https://i.redd.it/e7o3tq9s2og61.gif"
1612970103,"davebie","Did GME moon after SI report?","https://www.reddit.com/r/wallstreetbets/comments/lgvqb7/did_gme_moon_after_si_report/"
1612970040,"AhileyGusani","APHA merging - Next GME rise!","https://www.reddit.com/r/wallstreetbets/comments/lgvpfc/apha_merging_next_gme_rise/"
1612970025,"DJM661","SNDL!! GME was fun while it lasted 💎👏","https://i.redd.it/nmp0boqh2og61.jpg"
1612970014,"[deleted]","WHERE WE ARE WITH GME AND ‘THE GREAT SHORT OF ‘20’","https://www.reddit.com/r/wallstreetbets/comments/lgvp2j/where_we_are_with_gme_and_the_great_short_of_20/"
1612969909,"OOHHHHHHoney","Isn't strange that GME is going up when it is on the short shelling restriction list?","https://www.reddit.com/r/wallstreetbets/comments/lgvnn2/isnt_strange_that_gme_is_going_up_when_it_is_on/"
1612969815,"AmishOnReddit","Me trying to explain my positions in GME","https://i.kym-cdn.com/photos/images/newsfeed/001/855/914/ca4.jpg"
1612969731,"DacToil","GME today","https://www.reddit.com/r/wallstreetbets/comments/lgvl55/gme_today/"
